qID,Sentence,Option1,Option2,Answer
3ZCC2DXSD720BVV7ZAX42RWH6ZLYYV-2,Ne ko nde fi Kevin maraton boli ka nɔgɔn ka tɛmɛ Dennis kan. _ tun b’a fɛ ka sigarɛtimin dabila siɲɛ caman.,Kevin,Dennis,2
3ZCC2DXSD720BVV7ZAX42RWH6ZLYYV-1,"Tu ne Kevin y’a ye ko a nɔgɔyara ka boli maraton kan ka tɛmɛ Dennis kan, _ ale min labanna ka desizɔn ta ka sigarɛtimin dabila.",Kevin,Dennis,1
3SX4X51T82N2FOS9XFMQPC4GIKHOAI-2,"Lawrence tun ye laɲini kɛ ka ja nafama sonya Michael fɛ, bawo _ labanna ka fɛn cɛɲi dɔ sɔrɔ.",Lawrence,Michael,2
3SX4X51T82N2FOS9XFMQPC4GIKHOAI-1,"Lawrence tun b’a fɛ ka ja le ne sonya Michael fɛ, bawo _ tun b’a fɛ ka fɛn kabakoma dɔ sɔrɔ.",Lawrence,Michael,1
3EHVO81VN7ZWTJTMXJY7U2ED3YPH1I-2,"Jordan ye foro ni bɔgɔdaga di a ka so fitinin ma a ka to yen, wa _ tun ka di sow ye kosɛbɛ ni a sumana.",bɔgɔdaga,foro,2
3EHVO81VN7ZWTJTMXJY7U2ED3YPH1I-1,"Jordan ye foro ni bɔgɔdaga di a ka so fitinin ma a ka to a kɔnɔ, wa _ tun ka di sow ye kosɛbɛ ni nɛnɛ tun bɛ yen.",bɔgɔdaga,foro,1
3J6BHNX0UB6Q9G1J8RZ24178YD1KNU-1,"O hakilina dira Steven ma, a ma di Ryan ma, bawo _ ka ca ni daɲɛw ye.",Steven,Ryan,1
3J6BHNX0UB6Q9G1J8RZ24178YD1KNU-2,"O hakilina dira Steven ma, a ma di Ryan ma, bawo _ tɛ daɲɛw dabɔ kosɛbɛ.",Steven,Ryan,2
38DCH97KHJGG1T8T6YR77G2ZNUIJQY-2,"Michael ye dumunikɛminɛnw san i n’a fɔ sokɔnɔbaganw ka dumuni, nka Kenneth ma o kɛ bawo _ tun bɛ ni sow ye i n’a fɔ sokɔnɔbagan.",Michael,Kenneth,2
38DCH97KHJGG1T8T6YR77G2ZNUIJQY-1,"Michael ye dumunikɛminɛnw san ka kɛ sokɔnɔbaganw ka dumuni ye, nka Kenneth ma o kɛ bawo _ tun bɛ ni wulu ye i n’a fɔ sokɔnɔbagan.",Michael,Kenneth,1
3BA7SXOG1L4RTDRAS9JGNG3R5E6R8P-1,"Baro sɛgɛnnen kɔfɛ, jɛmukan ɲɛnama dɔ kɛra.  _ tun bɛ sɛgɛn kosɛbɛ.",baro,jɛmukan,1
3BA7SXOG1L4RTDRAS9JGNG3R5E6R8P-2,"Baro sɛgɛnnen kɔfɛ, jɛmukan ɲɛnama dɔ kɛra.  _ tun ka di kosɛbɛ.",baro,jɛmukan,2
3X2LT8FDHWGH7K9P75HMIHNZ2BB8WJ-1,Lawrence ye waleɲumandɔn jira u ka nilifɛn na ka tɛmɛ Benjamin kan u ta kan bawo _a tun ye fɛn caman sɔrɔ ka tɛmɛ o kan.,Lawrence,Benjamin,1
3X2LT8FDHWGH7K9P75HMIHNZ2BB8WJ-2,Lawrence ye waleɲumandɔn jira u ka nilifɛn na ka tɛmɛ Benjamin kan u ta kan bawo _ tun ye o sɔrɔ ka dɔgɔ kosɛbɛ.,Lawrence,Benjamin,2
30IRMPJWDZHWUPU4H04JLNO95XYKRL-2,"Mariyama ye pake nafama dɔ ci Sarah ma, o la _ a y'a ta lase la.",Mary,Sarah,2
30IRMPJWDZHWUPU4H04JLNO95XYKRL-1,"Mariyama ye pake nafama dɔ ci Sarah ma, o la _ a taara n'a ye lase la.",Mary,Sarah,1
37AQKJ12TXM8DNXJFYN6MTCNC09TTA-2,Craig y’a yɛrɛ di ka kalandenw dɛmɛ minnu bɛ kalanbaliya la lakɔliso la k’a sɔrɔ Joel y’a yɛrɛ tanga u ma bawo _kalan tun ka gɛlɛn a ma.,Craig,Joel,2
37AQKJ12TXM8DNXJFYN6MTCNC09TTA-1,Craig y’a yɛrɛ di ka kalandenw dɛmɛ minnu bɛ kalanbaliya la lakɔliso la k’a sɔrɔ Joel tun b’a yɛrɛ tanga u ma bawo _ kalan tun ka di a ye.,Craig,Joel,1
3LOJFQ4BOZTHN4A6JXLZ8WVEK9ZDK5-1,"Sarah ye Mariyama ka kuma kalanso ta; tuma min na a tɛmɛna a ka ɛkizamɛn laban na , _ ye seli kɛ ni kremi ye .",Sarah,Mary,1
3LOJFQ4BOZTHN4A6JXLZ8WVEK9ZDK5-2,"Sarah ye Mariyama ka kuma kalanso kalan; tuma min na a tɛmɛna a ka ɛkizamɛn laban na , _ ye seli kɛ ni kremi ye .",Sarah,Mary,2
3VMHWJRYHVE5BZO2POJEUSISYL0XFW-1,"Joseph y'a latigɛ k'u ka wulu labɛn makɔnɔyɔrɔ la a tɛ i n'a fɔ Leslie, o de la _ ye wulu saniya.",Joseph,Leslie,1
3VMHWJRYHVE5BZO2POJEUSISYL0XFW-2,"Joseph y'a latigɛ k'u ka wulu labɛn makɔnɔyɔrɔ la a tɛ i n'a fɔ Leslie, o de la _ ye wulu nɔgɔlenba sɔrɔ.",Joseph,Leslie,2
3WKGUBL7SZK0DPAOROK7SUQE70KL4A-2,Muso tun b'a fɛ ka fini dulon alimɔri kɔnɔ nka _ tun ka bon kojugu.,alimɔri,fini,2
3WKGUBL7SZK0DPAOROK7SUQE70KL4A-1,Muso tun b'a fɛ ka fini dulon alimɔri kɔnɔ nka _ tun ka dɔgɔ kojugu.,alimɔri,fini,1
371Q3BEXDJNIEOSAGOJYQA5RQUIZSM-2,"Ian ma kuru ye Brett sen na, bawo _ tun bɛ ka ɲɛ sɛgɛsɛgɛli dɔrɔn de kɛ.",Ian,Brett,2
371Q3BEXDJNIEOSAGOJYQA5RQUIZSM-1,"Ian ma kuru ye Brett sen na, bawo _ tun bɛ ka ɲɛ sɛgɛsɛgɛli dɔrɔn de la.",Ian,Brett,1
3G3AJKPCXN6Z7DGUU1LXE0GI4024YC-2,"Kabakurun minnuw lajɛlen do bɔrɔ kɔnɔ, olu ka ca ka tɛmɛ wari misɛni dalajɛlenw kan bawo _ hakɛ ka dɔgɔ.",kabakurun,wari misɛniw,2
3G3AJKPCXN6Z7DGUU1LXE0GI4024YC-1,"Kabakurun le ne caman bɛ kɔnɔ ka tɛmɛ warijɛ minnu lajɛra, bawo _ ka ca kosɛbɛ.",kabakurun,kodebe,1
3ZC62PVYDH8MBLFNPIP00ZIZ2NGXX1-2,"Samuel tun bɛ aliminiyɔmu bidonw lakurayali ɲɛdɔn , nka Logan tun t'o kɛ bawo _  mago tun ma jɔ wari  wɛrɛ la abada",Samuel,Logan,2
3ZC62PVYDH8MBLFNPIP00ZIZ2NGXX1-1,"Samuel tun bɛ aliminiyɔmu bidonw lakurayali ɲɛdɔn, nka Logan tun t’o kɛ bawo _ tun mago bɛ wari wɛrɛw la tuma bɛɛ.",Samuel,Logan,1
3VMV5CHJZ8D48IBDVYOZNAXYRK6GTQ-1,"Sanni a Jessica ara kɛ ni o fɛn ye min bɛ wele ko generic brand walasa k’a kunsigi ko, a ye o _ luxury sugandi. Marka in kunsigi ka di.",ɲinama,banabana,1
3VMV5CHJZ8D48IBDVYOZNAXYRK6GTQ-2,Jessica ye marka premium sugandi walasa k’a kunsigi ko sanni ka marque sabatilen ta. O _ marka in y’a to a kunsigi bɔra a la.,ɲinama,banbana,2
3L84EBDQ370A7LH9RGVMKB2VA7WKKO-2,"Wulu tun bɛ Rachel bolo nka Sintia ka wulu bilala ka ta ladonni yɔrɔ la kɔsa in na, o de la _ y'a ka juru kɔrɔ di a ma.",Rachel,Cynthia,2
3L84EBDQ370A7LH9RGVMKB2VA7WKKO-1,"Wulu tun bɛ Rachel bolo nka Sintia ka wulu bilala ka ta ladonni yɔrɔ la kɔsa in na, o de la _ y'a ka juru kɔrɔ sɔrɔ.",Rachel,Cynthia,1
3ZTE0JGGCG6Q83P7HTIHV7U4IYFCO7-1,John ko ale bɛ kɛrɛmu sokolama fɛ ka tɛmɛ lemuru kumuni kɛrɛmu kan bawo _ ka di.,sokola,lemuru kumuni,1
3ZTE0JGGCG6Q83P7HTIHV7U4IYFCO7-2,John y’a fɔ ko sokola sɔgɔli ka di a ye ka tɛmɛ limoni sɔgɔlen kan bawo _ da man di.,sokola,limoni,2
3SR6AEG6W5REP05IPATGGR1EG75YH1-1,Bety  dɔn ne do ni kan fila fɔ de ye k’a sɔrɔ Rachel dɔn ne do ni kan caman fɔ ye bawo _ tɛ se ka  dɔwɛrɛ fɔ ni  kan fila tɛɛ.,Betty,Rachel,1
3SR6AEG6W5REP05IPATGGR1EG75YH1-2,Bety dɔn ne do ni kan fila fɔ de ye k’a sɔrɔ Rachel  dɔn ne do ni kan caman fɔ ye  bawo _ bɛ se ka tɛmɛ kan fila kan.,Betty,Rachel,2
3WUVMVA7OB1ZK379FQL7DCNCEN9ZAB-2,Sɛgɛ lafiɲɛ bɔ waati la an tora lotɛli dolo 3 la an tun tɛ lotɛli dolo 5 la bawo _ tun falen do.,dolo 3,dolo 5,2
3WUVMVA7OB1ZK379FQL7DCNCEN9ZAB-1,Sɛgɛ lafiɲɛ bɔ waati la an tora lotɛli dolo 3 la an tun tɛ lotɛli dolo 5 la bawo _ tun falen tɛ.,dolo 3,dolo 5,1
363A7XIFV60X5816YR84K4YPG8JVAQ-2,"Son tun bɛ se ka boli jona ni sanbara bɔcion ye, nka o tɛ se ka kɛ ni babini sanbara ye, bawo _ tun dilannen don ni fɛn ye min kaɲi.",babini sanbara,sanbara bɔcion,2
363A7XIFV60X5816YR84K4YPG8JVAQ-1,"A tun bɛ se ka kɛ son in tun bɛ se ka sɛgɛn ka don butikiw kɔnɔ, nka a tun tɛ se ka don sanbaraw kɔnɔ, bawo o tun _ don ni fɛn ye min ka dɔgɔ.",butikiw,sanbaraw,1
3LB1BGHFL2U4U9WDP4A5UA42WC8YTA-1,"Margot tun bɛ ka birifini min dilan, o tun ye alimɔri bɛɛ fa, bawo _ tun ka bon kosɛbɛ.",birifini,alimɔri,1
3LB1BGHFL2U4U9WDP4A5UA42WC8YTA-2,"Margot tun bɛ ka birifini min dilan, o tun ye alimɔri bɛɛ fa, bawo _ tun ka dɔgɔ.",birifini,alimɔri,2
3J9L0X0VDFKHLPSZCXN0IDIAR0OW9Y-2,Yala i bɛna i ka bolomafara di egilisi ma walima lakɔli ma wa? N'hakili la n'bɛna n'ta di _ ma bawo u mago bɛ ban kuraw la.,lakɔli,egilisi,2
3J9L0X0VDFKHLPSZCXN0IDIAR0OW9Y-1,Yala i bɛna i ka bolomafara di egilisi ma walima lakɔli ma wa? N'hakili la n'bɛna n'ta di _ ma bawo u mago bɛ ordinatɛri kuraw la.,lakɔli,egilisi,1
3IH9TRB0FDDWPE4631GSUEFS4CI1IC-2,Oak jiri kisira fɔɲɔba ma nka jiribolo in halakira. O kɛra bawo jiri _ tun kolo ka fɛgɛn kosɛbɛ.,Oak jiri,jiribolo,2
3IH9TRB0FDDWPE4631GSUEFS4CI1IC-1,Oak jiri kisira fɔɲɔba ma nka jiribolo in halakira. O kɛra bawo jiri _ tun kolo ka gɛlɛn kosɛbɛ.,Oak jiri,jiribolo,1
3N7PQ0KLI5N1PNHSAOSK5U8OFPL3EL-2,"Benjamin tun bɛ ni kamalenninya ye ka tɛmɛ Donald kan, o de la _ tun bɛ whoopie kusɛw kɔniya.",Benjamin,Donald,2
3N7PQ0KLI5N1PNHSAOSK5U8OFPL3EL-1,"Benjamin tun bɛ ni kamalenninya ye ka tɛmɛ Donald kan, o de la whoopie kusɛw tun ka di _ ye.",Benjamin,Donald,1
3K8CQCU3KEZ2ARWTD7650EDUR71WNO-2,"Sukaro ma fɛnw duni bara le ye gɛlɛyaba ye Kari bolo nka a tun ma gɛlɛn Rebeka bolo, o de y’a to _ cɛkisɛ ka dɔgɔn.",carrie,rebecca,2
3K8CQCU3KEZ2ARWTD7650EDUR71WNO-1,"A tun ka gɛlɛn Carrie ma ka dumuni duman dun, nka Rebecca ma o kɛ, o de y’a to _ a cɛmancɛ ka bon.",carrie,rebecca,1
3I01FDIL6OMM6O6GURFV809K39DD2J-2,"Le sol autour de la maison de Michael était dur, tandis que celui d'Aaron était fragile en raison de la pluie qui _ avait persisté pendant un mois.",Michael,Aaron,2
3I01FDIL6OMM6O6GURFV809K39DD2J-1,"Dugukolo min tun kɛlen don ka Michael ka so lamini o tun kolo ka gɛlɛn, ka tɛmɛ Aaron ka yɔrɔ ta kan, bawo _ tun ye ja sɔrɔ min ye kalo kelen kɛ.",Michael,Aaron,1
3R5LWXWHR06BPZKX08PWCDI44HGXGE-1,"Megan ye pikiri biɛn don Sara bolo jelisirala u selen dɔgɔtɔrɔso la, bawo _ tun ye furakɛla ye.",Megan,Sarah,1
3R5LWXWHR06BPZKX08PWCDI44HGXGE-2,"U donna dɔgɔtɔrɔso la tuma min na, Megan ye IV don Sara bolo la bawo _ farikolojidɛsɛ tun b’a la.",Megan,Sarah,2
3XD2A6FGFP838XAXCQPZDM3YANKS9H-2,"Sanjiba nana ani fini tun ɲiginnen don. Kulɛriw y’a daminɛ ka fara ɲɔgɔn kan. A ba ka fɔ la, _ tun bɛ dulon cogo o cogo, wa a ka finiw tun ka ca kojugu.",damine,finiw,2
3XD2A6FGFP838XAXCQPZDM3YANKS9H-1,"Sanjiba nana ani fini tun ɲiginnen don. Kulɛriw y’a daminɛ ka fara ɲɔgɔn kan. A ba ka fɔ la, _ tun man di cogo o cogo bawo a kulɛri tun ka ca kojugu.",sanjiba,kuleri,1
385MDVINFETLLQ4FI7QDZ5KLBPRWJV-1,"Sugu kɔnɔ, a tun ka kan ka tabali bila fini kura bila a nɔ na bawo _ tun falen don kojugu fo fini kura bɛɛ tun tɛ se ka don a kɔnɔ.",tabali,kojugo,1
385MDVINFETLLQ4FI7QDZ5KLBPRWJV-2,"Tabali min tun bɛ sugo la, o tun ka kan ka wuli ni fini kura ye bawo _ tun ka bon kosɛbɛ walasa ka fini kura bɛɛ ladon.",tabali,wuli,2
3DWGDA5POF2MHVPZIA3BH5HDMDGV1S-2,Tobilikɛla y'a ɲini ka namasa don gato la nka _ tun ka bon kojugu.,gato,namasa,2
3DWGDA5POF2MHVPZIA3BH5HDMDGV1S-1,Tobilikɛla y'a ɲini ka namasa don gato la nka _ tun ka dɔgɔn kojugu.,gato,namasa,1
3LB1BGHFL4AJOYVK92M5M8SBLAVTYY-1,Brett tun bɛnnen don bangeko ma ka tɛmɛ Aaron kan bawo _ tun y’a ka waati caman kɛ ni denmisɛnw ye.,Brett,Aaron,1
3LB1BGHFL4AJOYVK92M5M8SBLAVTYY-2,Brett tun labɛnnen don ka ɲɛ ka kɛ bangebaga ye ka tɛmɛ Aron kan bawo _ tun ye waati fitini dɛ kɛ ni denmisɛnw ye.,Brett,Aaron,2
3IWA71V4TKUOMVUY8TSASKTOZWR6XV-2,"Patricia ye sɛnɛfɛn gɛlɛn dɔ sugandi, a tɛ i n’a fɔ Tania, bawo _ dugukolo tun ka ɲi kosɛbɛ.",Patricia,Tanya,2
3IWA71V4TKUOMVUY8TSASKTOZWR6XV-1,"Patricia ye sɛnɛfɛn gɛlɛn dɔ sugandi, a tɛ i n’a fɔ Tania, bawo _ dugukolo tun fra ka can kojugu.",Patricia,Tanya,1
31MBOZ6PAOP38TN3K3QPBS22ZFKLCA-1,"A tun kadi Donna ye ka kalan kɛ a ka baarakɛyɔrɔ la ni ka kɛ so, bawo _ tun mankan ka can.",so,baarakɛyɔrɔ,1
31MBOZ6PAOP38TN3K3QPBS22ZFKLCA-2,"A tun kadi Donna ye ka kalan kɛ a ka baarakɛyɔrɔ la ni ka kɛ so, bawo _ tun lafialen don",so,baarakɛyɔrɔ,2
3PEG1BH7AEP9EIDFL3ITL8J5NFRKBC-2,Donald ye Brett wele ka na Paris bawo _ tun bɛ fakan fɔcogo dɔn kɔsɔbɛ.,Donald,Brett,2
3PEG1BH7AEP9EIDFL3ITL8J5NFRKBC-1,Donald ye Brett wele ka na Paris bawo _ tun t'a fakan fɔcogo dɔn.,Donald,Brett,1
3ZXNP4Z39RJXWCS7TMIEV6AOTL97LC-2,Michael y’a don ko kraig ye dɔgɔtɔrɔ ye min bonyalen don o de la  _  ye ɲiningali caman kɛ a la kɛnɛyako kan.,Michael,Craig,2
3ZXNP4Z39RJXWCS7TMIEV6AOTL97LC-1,Michael y’a don ko kraig ye dɔgɔtɔrɔ ye min bonyalen don o de la  _  ye a ɲininga ko caman kan kɛnɛyako ta sira fɛ.,Michael,Craig,1
36QZ6V1589BMY0ZTQ38QHK23Y8MUSS-2,Glenda tun bɛ mobili kɔ kurulen de boli su fɛ tuma bɛɛ tɛmɛ farikoloɲɛnajɛ mobili kan bawo  _  yelen tun man di.,mobili kɔ kurulen,farikoloɲɛnajɛ mobili,2
36QZ6V1589BMY0ZTQ38QHK23Y8MUSS-1,Glenda tun bɛ mobili kɔ kurulen de boli su fɛ tuma bɛɛ tɛmɛ farikoloɲɛnajɛ kan bawo  _  yelen tun ka di.,mobili kɔ kurulen,farikoloɲɛnajɛ mobili,1
3CIS7GGG67X0I6TI960LK1MWLVOUE1-2,Rian bolila ka yɛlɛn Lan ka kɔbɔi ɲinɛ kan n’a ka mobili ye o kɛra sababu ye  _  ye tɔɔrɔ sɔrɔ.,Ryan,Ian,2
3CIS7GGG67X0I6TI960LK1MWLVOUE1-1,Rian bolila ka yɛlɛn Lan ka kɔbɔi ɲinɛ kan n’a ka mobili ye o kɛra sababu ye  _  ya yɛrɛ jalaki kosɛbɛ.,Ryan,Ian,1
3V8JSVE8YYO25QEGZ9LAVO41T4QEY9-1,"A tun ka nɔgɔn ka poto bali ka bin ka tɛmɛ beton kan, bawo _ tun ka girin.",beton,poto,1
3V8JSVE8YYO25QEGZ9LAVO41T4QEY9-2,"A tun ka nɔgɔn ka poto bali ka bin ka tɛmɛ beton kan, bawo _ tun ka fɛgɛn.",beton,poto,2
3D3B8GE892PR1GVY0B95QJAETLY9PO-2,"A tun ka nɔgɔn Joel bolo, nka a tun man nɔgɔn Kevin bolo, ka y ɲɛnajɛ k’a to yala yala la bawo _  tun ma kɛnɛ fɛrɛlenw diya don .",Joel,Kevin,2
3D3B8GE892PR1GVY0B95QJAETLY9PO-1,"A tun ka nɔgɔn Joel bolo, nka a tun man nɔgɔn Kevin bolo, ka ɲɛnajɛ kɛ k’a to yala yala la bawo _  tun ye kɛnɛ fɛrɛlenw diya don",Joel,Kevin,1
39TX062QX1MAVN895TICTJTVVXM3XO-2,"Denis ka cɛ ɔrimɔni  hakɛ tun ka can kosɛbɛ ka tɛmɛ kristofɛr kan, o de la _ y’a daminɛ ka hami ko a bɛ se ka den sɔrɔ.",Dennis,Christopher,2
39TX062QX1MAVN895TICTJTVVXM3XO-1,"Denis ka cɛ ɔrimɔni hakɛ tun ka can kosɛbɛ ka tɛmɛ kristokɛr kan, o de la _ ma hami ko a bɛ se ka den sɔrɔ.",Dennis,Christopher,1
31ODACBENUDU67SC9UOL7J5EQ59SQ9-1,Faransikan kalani tun ka nɔgɔn Angela ma ka tɛmɛ Samanta kan bawo _ tun ye kanko dɔnniya caman sɔrɔ.,Angela,Samantha,1
31ODACBENUDU67SC9UOL7J5EQ59SQ9-2,Faransikan kalani tun ka nɔgɔn Angela ma ka tɛmɛ Samanta kan bawo _ tun ma kanko dɔnniya caman sɔrɔ.,Angela,Samantha,2
33P2GD6NRP6YZKF85T4PZHACDA8KHK-1,"Emili tun bɛ ka babi bɔ ni babi kukala min ye babi bɔ yɔrɔ la, o tun datugulen bɛ ni la kraie caman ye ka tɛmɛ Beti tun bɛ ka  baby bɔ  ni min ye kan; o de kama, _ tun kaɲi ni frein  minɛ la.",Emily,Betty,1
33P2GD6NRP6YZKF85T4PZHACDA8KHK-2,"Emil tun bɛ ka babi bɔ kɛ ni babi kukala min ye babi bɔ yɔrɔ la, o tun datugulen bɛ ni la kraie caman ye ka tɛmɛ Beti tun bɛ ka baara kɛ ni min ye kan; o de kama, _ tun maɲi ni frein minɛ la.",Emily,Betty,2
3PCPFX4U40OL22NQ3AOM0KMZ1DNFQH-1,"Lɛti diya ka di Katrina ye, n'ka Angela t’a fɛ. _  ye salati ba lagnini kɛ sufɛdumuni kama .",Katrina,Angela,1
3PCPFX4U40OL22NQ3AOM0KMZ1DNFQH-2,"Lɛti diya ka di Katrina ye, n'ka Angela t’a fɛ. _  ye sogo ba lagnini kɛ sufɛdumuni kama .",Katrina,Angela,2
3PKVGQTFIHIREUJLLF5AUV3K8WLRYA-1,Jason sera Steven ma  ka kiri welesɛbɛn kofɔ ani kiritigɛso welesɛbɛn di a ma bawo _ tun bɛ baara kɛ i n’a fɔ kilalikɛ cogo baarakɛla.,Jason,Steven,1
3PKVGQTFIHIREUJLLF5AUV3K8WLRYA-2,Jason sera Steven ma ka kiri welesɛbɛn ani kiritigɛso welesɛbɛn di a ma bawo _ tun nɔminɛlen do,Jason,Steven,2
3PN6H8C9R64BBR1K768AEISIFNKDAL-2,Ba tun bɛ gafe dɔ lajɛ tuma bɛɛ a ka kɔnɔmaya kama bawo _ tun bɛ mɔgɔ blasira kosɛbɛ.,kɔnɔmaya,gafe,2
3PN6H8C9R64BBR1K768AEISIFNKDAL-1,Ba tun bɛ to ka gafe dɔ lajɛ a kɔnɔmaya kama bawo _ tun ka gɛlɛn kosɛbɛ.,kɔnɔmaya,gafe,1
3DGDV62G7QNVVL96Z06Q8UQ9HIVP24-2,"Tuma min na Mani ye wulu ka dilan kura san a sulu kama, a jigi tigɛra tuma min na a y’a ɲini k’a ladon a kɔnɔ . A _ tun ka dɔgɔn kojugu.",wulu ka dilan,sulu,2
3DGDV62G7QNVVL96Z06Q8UQ9HIVP24-1,"Tuma min na Mani ye wulu ka dilan kura san a sulu kama, a jigi tigɛra tuma min na a y’a ɲini k’a ladon a kɔnɔ . A _ tun ka bon kojugu.",wulu ka dilan,sulu,1
3SZYX62S5GYJUNPM1Z27EHER7V975O-2,"Natali ye Monika dɛmɛ a ka tugu  furakɛli cogo dɔ la,  _ kɛlen ka kuma a ka dɔrɔguta kan.",Natalie,Monica,2
3SZYX62S5GYJUNPM1Z27EHER7V975O-1,"Natali ye Monika dɛmɛ a ka tugu furakɛli cogo dɔ la,  _ kɛlen ka a ka dɔrɔguta ta ko kuma mɛn.",Natalie,Monica,1
30OITAWPBSHEIOWH1WD098WV0469HX-1,Nelson taara dɔgɔtɔrɔ ka biro la ka Denis to bawo _ tun ka kan k'a ka furasɛbɛn falen.,Nelson,Dennis,1
30OITAWPBSHEIOWH1WD098WV0469HX-2,Nelson taara dɔgɔtɔrɔ ka biro la Denis to bawo _ tun ka kan k'a ka motɛri tulu falen.,Nelson,Dennis,2
30Y6N4AHYPUOGJOUPJIWHATJQ5TDRW-2,So bɛ yala binnan de fɛ ka tɛmɛ wɛrɛ kan bawo a so ka dɔgɔ _  walasa so bɛ se ka la sama.,yala binnan,wɛrɛ,2
30Y6N4AHYPUOGJOUPJIWHATJQ5TDRW-1,So bɛ yala binna de fɛ ka tɛmɛ wɛrɛ kan bawo a so ka bon _  walasa so bɛ se ka la sama.,yala binnan,wɛrɛ,1
3KQC8JMJGE6S3M71KNCQIVT908NH37-2,A ma deli ka se ka ɲɛsi kurulan kɛ a ɲɛsiw kan barisa _ ka jan kojugu.,ɲɛsi,ɲɛsi kurulan,2
3KQC8JMJGE6S3M71KNCQIVT908NH37-1,A ma deli ka se ka ɲɛsi kurulan kɛ a ɲɛsiw kan barisa _ ka misɛn kojugu.,ɲɛsi,ɲɛsi kurulan,1
37VE3DA4YUFICSC7FIFW8G3D0EBBHO-2,Lan y’a ɲini Kevin fɛ a k’a dɛmɛ a ka nisɔngɔ sara bawo _ tun ye jatebɔla ye min bɛ se kosɛbɛ.,Ian,Kevin,2
37VE3DA4YUFICSC7FIFW8G3D0EBBHO-1,Kevin y’a ɲini Lan fɛ a k’a dɛmɛ a ka nisɔngɔ sara bawo _ tun ye jatebɔla ye min bɛ se kosɛbɛ.,Ian,Kevin,1
3ROUCZ907H8RHSMA7YR8Q7OM9ZFOOB-1,"Sulen ya kunkolodimi ka jugu tiɲɛ na, nka u man jugu i n’a fɔ kunkolodimi barisa _ bɛ ban joona.",Sulen ya kunkolodimi,kunkolodimi,1
3ROUCZ907H8RHSMA7YR8Q7OM9ZFOOB-2,"Sulen ya kunkolodimi ka jugu tiɲɛ na, nka u man jugu i n’a fɔ kunkolodimi barisa _ bɛ mɛn senna",Sulen ya kunkolodimi,kunkolodimi,2
3IJ95K7NDXA6D56TY22NEBR624CNGS-1,"Ikomi Jenifɛr mago tun bɛ finiw na ka sɔrɔ finiw caman tun bɛ Natali bolo, _ ye finiw san yugu yugu feereyɔrɔ la.",Jennifer,Natalie,1
3IJ95K7NDXA6D56TY22NEBR624CNGS-2,"Ikomi Jenifɛr mago tun bɛ finiw na ka sɔrɔ finiw caman tun bɛ Natali bolo, _ ye finiw di yugu yugu feereyɔrɔ la.",Jennifer,Natalie,2
3VADEH0UHEBO0KQ4TFLWZC3DGTESPT-2,"A y’a ye ko fununa mugu b’a bolo gato kama, nka a ye bikaribonati singa a sigiɲɔgɔn fɛ a ya sɔrɔ _  tun falen don.",bikaribonati,fununa mugu,2
3VADEH0UHEBO0KQ4TFLWZC3DGTESPT-1,"A y’a ye ko fununa mugu b’a bolo gato kama, nka a ye bikaribonati singa a sigiɲɔgɔn fɛ a ya sɔrɔ _  tun bannen don.",bikaribonati,fununa mugu,1
3IYI9285WUEC7SYA1GQCNBDJKKNJCC-1,Justin tun ka ɲi kosɛbɛ dɔnkilida la ni gitari ye a tɛ i n’a fɔ kraig bawo _ tun bɛ fɔli kɛ kosɛbɛ.,Justin,Craig,1
3IYI9285WUEC7SYA1GQCNBDJKKNJCC-2,Justin tun ka ɲi kosɛbɛ dɔnkilida la ni gitari ye a tɛ i n’a fɔ kraig bawo _ tun ye farikoloɲɛnajɛla ba ye .,Justin,Craig,2
3D1UCPY6GINZAB68HJIK5I0AXUH388-2,Seila ma a ka nɛgɛ fla funteni lajɛ sani a k’a kunsigi laben. A _ tun jalen.,nɛgɛ,kunsigi,2
3D1UCPY6GINZAB68HJIK5I0AXUH388-1,Sheila ma a ka nɛgɛ fla funteni lajɛ sani a k’a kunsigi laben. A _ tun ka kalan.,nɛgɛ,kunsigi,1
36KM3FWE3TQZT52SOR8VPK69K5E70Y-2,"Callie tun bɛ dɔn kɛ ka tɛmɛ gitari fɔ kan, hali ni dɔgɔkun nata kow tun ye _ ye.",dɔn,gitari,2
36KM3FWE3TQZT52SOR8VPK69K5E70Y-1,"Callie tun bɛ dɔn kɛ ka tɛmɛ gitari fɔ kan, hali ni dɔgɔkun nata kow tun ye _",dɔn,gitari,1
334ZEL5JX8T6FKE3EF8HACYN590OSV-2,Wulu si bɔra la a nɔrɔlen kɔ bɔgɔ la bawo _ tun saniyalen don.,bɔgɔ,si,2
334ZEL5JX8T6FKE3EF8HACYN590OSV-1,U kunsigi bɔra a sirilen kɔ bɔgɔ la bawo a tun bɛ _ siran.,kunsigi,la,1
3NCN4N1H1IVPGDXP2EM95YOIBOFNBA-2,"Jatikɛ wale tun ye haminanko ye togoda la, n'ka gɛlɛya tun tɛ duguba kɔnɔ, bawo _  kɔnɔ bɛn tun bɛ mɔgɔw ni ɲɔgɔn cɛ kosɛbɛ.",togoda,duguba,2
3NCN4N1H1IVPGDXP2EM95YOIBOFNBA-1,"Jatikɛ wale tun ye haminanko ye togoda la, n'ka gɛlɛya tun tɛ duguba kɔnɔ, bawo _  bɛnbaliya tun bɛ mɔgɔw ni ɲɔgɔn cɛ kosɛbɛ.",togoda,duguba,1
3OEWW2KGQJ9LJ6WEXR1SNFOEAZPDOW-1,"Telu tun bɛ Jason kuna, n'ka Unter kunsigi tun ka can, o la _ tun man kan ka kunsigi bɔlan san.",Jason,Hunter,1
3OEWW2KGQJ9LJ6WEXR1SNFOEAZPDOW-2,"Telu tun bɛ Jason kuna, n'ka Hunter kunsigi tun ka can, o la _ tun ka kan  kunsigi bɔlan san.",Jason,Hunter,2
3VI0PC2ZA0YEB1028PE49KFFLXYXOR-1,"Kunsigi tun tɛ son ka kori, n'ka a tun kaɲi kosɛbɛ so kusi la.  A _ len tun cɛmaɲi.",kori,so kusi,1
3VI0PC2ZA0YEB1028PE49KFFLXYXOR-2,"Kunsigi tun tɛ son ka kori, n'ka a tun kaɲi kosɛbɛ so kusi la.  A _ ma tun cɛkaɲi.",kori,so kusi,2
3W5PY7V3UP5AG608DAW1S4HTYEGJYX-1,"a bɛna sini tile bɛɛ ta ka bere surunman woloma, janmajan ta ye lɛrɛ damadɔ dɔrɔn de kɛ , _ bɛ ye.",janmajan,surunman,1
3W5PY7V3UP5AG608DAW1S4HTYEGJYX-2,"a bɛna sini tile bɛɛ ta ka bere surunw woloma , janmajan ye lɛrɛ damadɔ dɔrɔn de kɛ , _ tɛ se ka ye.",janmajan,surunman,2
3KA7IJSNW8JPJY92ITZ19NTCAWUBPR-1,"kabanɔgɔ ye siranba de don mɔgɔw la, k'a sɔrɔ sankolo jɛlen y'u hakili sigi, bawo _ tun bɛ u jɔrɔ kosɛbɛ.",kabanɔgɔ,sankolo,1
3KA7IJSNW8JPJY92ITZ19NTCAWUBPR-2,"kabanɔgɔ ye siranba de don mɔgɔw la, k'a sɔrɔ sankolo jɛlen y'u hakili sigi, bawo _ tun bɛ u basigi kosɛbɛ.",kabanɔgɔ,sankolo,2
32TZXEA1ONY2H75RICEO0D59YXA14V-2,Bana in tun bɛ yɛlɛma mɔgɔw fɛ kosɛbɛ. A ka finiw ni a ka sow jenina de. _ bɛɛ tiɲɛna.,sow,finiw,2
32TZXEA1ONY2H75RICEO0D59YXA14V-1,Bana in tun bɛ yɛlɛma mɔgɔw fɛ kosɛbɛ. A ka finiw ni a ka sow jenina de. _ tun ka bon kɔsɛbɛ.,sow,finiw,1
30QQTY5GMKI0F2F120AFMT67BR6U7W-1,Dina ye nɔnɔ yawuru di a denw ma ka kɛrɛmu tɔ ye bawo a tun b’a miiri ko _  tun ye fen nafama ye.,yawuru,kɛrɛmu,1
30QQTY5GMKI0F2F120AFMT67BR6U7W-2,Dina ye nɔnɔ yawuru di a denw ma ka kɛrɛmu tɔ ye bawo a tun b’a miiri ko _  tun tɛ fen nafama ye.,yawuru,kɛrɛmu,2
3A3KKYU7P3FWS9BT16R5NZOURYHMW7-1,"Heather ye bebe deni san a denmuso ka dilan kama, bebe dini ma bɛn a ma, _ tun ka dɔgɔ kojugu.",dilan,bebe dini,1
3A3KKYU7P3FWS9BT16R5NZOURYHMW7-2,"Heather ye bebe deni san a denmuso ka dilan kama, bebe dini ma bɛn a ma, _ tun ka bon kojugu.",dilan,bebe dini,2
3FDWKV9VCPGYUULVQ4O4X9R6VHMUM4-2,U ka kan k’u ka dumunimarayɔrɔw kuraya minɛnw caman sanni kɔfɛ bawo _ ka ca kojugu.,dumunimarayɔrɔw,minɛnw,2
3FDWKV9VCPGYUULVQ4O4X9R6VHMUM4-1,U ka kan k’u ka dumunimarayɔrɔw kuraya minɛnw caman sanni kɔfɛ bawo _ ka dɔgɔn kojugu.,dumunimarayɔrɔw,minɛnw,1
35YHTYFL1G1D7AJ7P9IW67L7IASVFR-1,"Ikomi Robert tun kunsigi be ka bin ani o tun te ka kɛ Brian la, _ tun bɛ keleya a kunsigi la.",Robert,Brian,1
35YHTYFL1G1D7AJ7P9IW67L7IASVFR-2,"Hali ni Robert tun kunsigi be ka bin ani o tun te ka kɛ Brian la, _ tun bɛ keleya a kunsigi la.",Robert,Brian,2
31GN6YMHLR6EKTN551ZRR6B98MFSWD-1,"A tun b’a fɛ ka ɲɛgɛn papiye kɛ ka firifirinin dilan ni papiye tiyo ani pɛntiri, n'ka a ma se ka ban bawo _ tun sɔrɔli ka gɛlɛn.",pɛntiri,tiyo,1
31GN6YMHLR6EKTN551ZRR6B98MFSWD-2,"A tun b’a fɛ ka ɲɛgɛn papiye kɛ ka firifirinin dilan ni papiye tiyo ani pɛntiri, n'ka a ma se ka ban bawo _ tun ka bon kojugu.",pɛntiri,tiyo,2
3X52SWXE0ZJYDCY98F9RC17QLFAWCT-2,"Lawrence ye u ka sira jɔsi ni pelu ye nɛzikɔfɛ k’a sɔrɔ Aron y’a yɛrɛ tanga o kɛli ma, o de la _ ka sira dɔ tun datugulen don ni nɛzi ye.",Lawrence,Aaron,2
3X52SWXE0ZJYDCY98F9RC17QLFAWCT-1,"Lawrence ye u ka sira jɔsi ni pelu ye nɛzikɔfɛ k’a sɔrɔ Aron y’a yɛrɛ tanga o kɛli ma, o de la _ ka sira dɔ tun datugulen ni nɛzi ye.",Lawrence,Aaron,1
3HEM8MA6HBQCN4BR1BWR4COBWICQP7-1,Kanu ba tun bɛ Cathy ni a ka wulu cɛ ka tɛmɛ a ka jakuma kan bawo a ka _  tun tɛ gɛrɛ a la.,jakuma,wulu,1
3HEM8MA6HBQCN4BR1BWR4COBWICQP7-2,Kanu ba tun bɛ Cathy ni a ka wulu cɛ ka tɛmɛ a ka jakuma kan bawo a ka _ ka kanu ka bɔn.,jakuma,wulu,2
3TKXBROM5VO3KVKATQMYYEBDWK1IJU-2,"Patricia tun bɛ yɔrɔ saniya tuma bɛɛ Angela kɔfɛ, bawo _ tun tɛ nɔgɔ jate.",Patricia,Angela,2
3TKXBROM5VO3KVKATQMYYEBDWK1IJU-1,"Patricia tun bɛ yɔrɔ saniya tuma bɛɛ Angela kɔfɛ, bawo _ tun t’a fɛ ka to nɔgɔ la.",Patricia,Angela,1
3M93N4X8HM1SE9N6Y2GC2GH17WPJS5-1,Michael y’a ɲini Brett fɛ a k’a dɛmɛ ka tabali dɔ bɔ a nɔla. _ tun tɛ se k' o kɛ a kelen na .,Michael,Brett,1
3M93N4X8HM1SE9N6Y2GC2GH17WPJS5-2,Michael y’a ɲini Brett fɛ a k’a dɛmɛ ka tabali dɔ bɔ a nɔla. _ fɛnɛ kelen tun tɛ se k' o kɛ.,Michael,Brett,2
35ZRNT9RUKC2V3TOO07G24QACWE3OY-1,"A tun ka di Jennifer ye ka jri min n'ka a tun ka di Laura ye ka sigarɛti de min. _ labanna ka don sigida kaso la , bawo fɛn min  kadi a ye, a ye o min jamala.",Jennifer,Laura,1
35ZRNT9RUKC2V3TOO07G24QACWE3OY-2,"A tun ka di Jennifer ye ka jri min n'ka a tun ka di Laura ye ka sigarɛti de min. _ labanna ka tagan sigida kaso la dɔn ma , bawo fɛn min kadi a ye, a ye o min jamala.",Jennifer,Laura,2
3QXFBUZ4ZKEJ8VQ2V3E9S6J0AZ5GUB-2,"Jeffrey tun b’a miiri ko Robert tun bɛ ka a sɛgɛsɛgɛ kɛrɛnkɛrɛnnenya la, bawo _ tun ye dɛndɛnlikɛla ye.",Jeffrey,Robert,2
3QXFBUZ4ZKEJ8VQ2V3E9S6J0AZ5GUB-1,"Jeffrey tun b’a miiri ko Robert tun bɛ ka a sɛgɛsɛgɛ kɛrɛnkɛrɛnnenya la, bawo _ tun ye siranbaga tɔ ye.",Jeffrey,Robert,1
3K2CEDRACBZ40S7Z61MU0FHVN6HTMA-1,"Frank taara banki la ka juru ta walasa ka mobili kura san, ani _ tun bɛ ka sigasiga kosɛbɛ.",juru,mobili,1
3K2CEDRACBZ40S7Z61MU0FHVN6HTMA-2,"Frank taara banki la ka juru ta walasa ka mobili kura san, ani _ tin ka farin kosɛbɛ.",juru,mobili,2
3VZYA8PITQCK61O90YTYR0SCSTN506-1,Christopher mago bɛ Ian ka laadilikanw na walasa ka kalanso kɔnɔna sigui  dia bawo _ ye karamɔgɔ kura ye.,Christopher,Ian,1
3VZYA8PITQCK61O90YTYR0SCSTN506-2,Christopher mago bɛ Ian ka laadilikanw na walasa ka kalanso kɔnɔna sigui dia bawo _ ye karamɔgɔ ye min ka donta ka can.,Christopher,Ian,2
3O2Y2UIUCQSZRZPVQ54P4YAQ27VFKP-2,"Ka tɛmɛ cɛya ni musoya fɛ o tun ka gɛlɛn Emily bolo, n'ka Christine kun tɛ bawo _ ka ɔrimɔni ka dɔgɔ kosɛbɛ.",Emily,Christine,2
3O2Y2UIUCQSZRZPVQ54P4YAQ27VFKP-1,"Delen de gɛlɛn Emily ma ka tɛmɛ cɛya ni musoya la, k’a sɔrɔ Christine tun bɛ ni _ ɔrimɔni barikamaw ye kosɛbɛ minnu tun bɛ na ni kunfilanitu ye.",Emily,Christine,1
3A520CCNWNY198GDJ37US2MULV6EAD-1,"Tulips ka di Hunter ye Ryan t'a fɛ, o de la _ taara magasasin la ka dɔw san.",Hunter,Ryan,1
