qID,Sentence,Option1,Option2,Answer
3QHITW7OYO7Q6B6ISU2UMJB84ZLAQE-2,"Ian y’a yɛrɛ di Dennis ka menudo naji dun ma, o kɔfɛ a ye tasa kelen naji min bawo _ tɛ furu naji fɛ.",Ian,Dennis,2
3QHITW7OYO7Q6B6ISU2UMJB84ZLAQE-1,"Ian y’a yɛrɛ di Dennis ka menudo naji dun ma, o kɔfɛ a ye tasa kelen naji min bawo _ bɛ furu naji fɛ.",Ian,Dennis,1
3XWUWJ18TLO2DDRXF83QWLKRJ29UU4-1,"An bɛ a tilayɔrɔba dɔrɔn de ye, abada le nka i bɛ taa a ka so bani le bɛɛ bawo _ kani dɔgɔ",So,So,1
3XWUWJ18TLO2DDRXF83QWLKRJ29UU4-2,An bɛ a tilayɔrɔba dɔrɔn de ye le abada le nka i bɛ taa a ka so tume tuma bɛɛ bawo _ ka bon,So,So,2
3D5G8J4N5CI2K40F4RZLF9OG2CKVTH-2,"Kile tɛ sosɛti janw don ka taa a da, k’a sɔrɔ Logan bɛ o don tuma bɛɛ. _ ka teli ka sigi yɔrɔ la min nɛnɛ ka bon .",Kyle,Logan,2
3D5G8J4N5CI2K40F4RZLF9OG2CKVTH-1,"Kile tɛ sosɛti janw don ka taa a da, k’a sɔrɔ Logan bɛ o don tuma bɛɛ. _ ka teli ka sigi yɔrɔ la min funteni ka bon .",Kyle,Logan,1
3DW3BNF1GHG4SV9KHVCQWF4L0K98VE-2,GPS ni karti ye n dɛmɛ ka se so. N tununna tuma min na _ ɲagamina.,GPS,karti,2
3DW3BNF1GHG4SV9KHVCQWF4L0K98VE-1,GPS ni karti ye n dɛmɛ ka se so. N tununna tuma min na _ fagara.,GPS,karti,1
3DTJ4WT8BFTH45NSFTZT1T1BND3ZEV-2,"Emily y’a ɲɛ kɔrɔta k’a ye ko Patricia bɛ boli a kun sanfɛ, k’a sɔrɔ _ tun bɛ yɛlɛnyɛlɛnnan kan",Emily,Patricia,2
3DTJ4WT8BFTH45NSFTZT1T1BND3ZEV-1,"Emily y’a ɲɛ kɔrɔta k’a ye ko Patricia bɛ boli a kun sanfɛ, k’a sɔrɔ _ tun bɛ yɛlɛnyɛlɛnnan jukɔrɔ",Emily,Patricia,1
304QEQWKZRY6EBUR5DPX06S39IH0OJ-2,Nafolomarayɔrɔ baarakɛlaw ye sanu kuruw bɔ wotoro kɔnɔ k’u dalajɛ fɛnmarayɔrɔ la fo ka _ lankolonya.,fɛnmarayɔrɔ,wotoro,2
304QEQWKZRY6EBUR5DPX06S39IH0OJ-1,Nafolomarayɔrɔ baarakɛlaw ye sanu kuruw bɔ wotoro kɔnɔ k’u dalajɛ fɛnmarayɔrɔ la fo ka _ fa,fɛnmarayɔrɔ,wotoro,1
36FFXPMSTB2HPB0N3LWI6YRLWWHHOX-1,"A tun b’a miiri ko a bɛna waati sɔrɔ ka sira cɛɲi tama ka taa butigi la, nka _ tun bɛ ka gilan.",sira,butigi,1
36FFXPMSTB2HPB0N3LWI6YRLWWHHOX-2,"A tun b’a miiri ko a bɛna waati sɔrɔ ka sira cɛɲi tama ka taa butigi la, nka _ da tugura joona.",sira,butigi,2
37SOB9Z0SUBUPIQRB8ROANMHJ463L8-2,"A hakili jigira ko a tun bɛ a dimi cogo min na ka buguri bɔ a ka jirisigilan na, o de la a ye tabali mana ma san o nɔ na.  _ saniyali bɛ teliya.",sigilan,tabali,2
37SOB9Z0SUBUPIQRB8ROANMHJ463L8-1,"A hakili jigira ko a tun bɛ a dimi cogo min na ka buguri bɔ a ka jirisigilan na, o de la a ye tabali mana ma san o nɔ na.  _ saniyali bɛ be waati caman ta.",sigilan,tabali,1
3D1UCPY6GINZAB68HJIK5I0BYMV83E-2,"Walasa ka se sɔrɔ ŋaniyajuguya kɛwalew kan, an kan k'an sinsin kosɛbɛ kɛwale hakilimaw yɛlɛmali kan ni kɛwale hakilitanw ye bawo kewale _ bɛ kɛ ni ŋaniya ye.",hakilimaw,hakilitanw,2
3D1UCPY6GINZAB68HJIK5I0BYMV83E-1,"Walasa ka se sɔrɔ ŋaniyajuguya kɛwalew kan, an kan k'an sinsin kosɛbɛ kɛwale hakilimaw yɛlɛmali kan ni kɛwale hakilitanw ye bawo kewale _ tɛ kɛ ni ŋaniya ye.",hakilimaw,hakilitanw,1
3R5LWXWHR2MQJOJ4K61W4B6CS5OGXO-2,Megan ka wari ka dɔgɔ kosɛbɛ ka tɛmɛ Jessica ta kan bawo _ ye lotori biye min ye se sɔrɔ san dɔrɔn.,Megan,Jessica,2
3R5LWXWHR2MQJOJ4K61W4B6CS5OGXO-1,Megan ka wari ka can kosɛbɛ ka tɛmɛ Jessica ta kan bawo _ ye lotori biye min ye se sɔrɔ san dɔrɔn.,Megan,Jessica,1
3NRZ1LDP7W4677DB493437C7D3WZP2-2,"N ye tiga ni rezɛn dɔ ta ka kɛ dumuni misɛnnin ye. N tun b’a fɛ ka dumuni timiman sɔrɔ, o de la n ye _ mara sisan.",rezɛn,tiga,2
3NRZ1LDP7W4677DB493437C7D3WZP2-1,"N ye tiga ni rezɛn dɔ ta ka kɛ dumuni misɛnnin ye. N tun b’a fɛ ka dumuni timiman sɔrɔ, o de la n ye _ dun sisan.",rezɛn,tiga,1
3X55NP42EOE5ME6IJ28VZ67STRW3P5-1,"A ka di Craig ye tiɲɛ na ka saniya tuma bɛɛ, nka Derrick tɛ o fɛ bawo _ bɛ labɛn kosɛbɛ.",Craig,Derrick,1
3X55NP42EOE5ME6IJ28VZ67STRW3P5-2,"A ka di Craig ye tiɲɛ na ka saniya tuma bɛɛ, nka Derrick tɛ o fɛ bawo _ tɛ labɛn kosɛbɛ.",Craig,Derrick,2
3JHB4BPSFMNRVHVKKM0UIMOWRR29QT-1,Dennis y’a ka marto di Robert ma walisa a ka se ka pɔnti gèngen. Marto caman tun bɛ _ bolo.,Dennis,Robert,1
3JHB4BPSFMNRVHVKKM0UIMOWRR29QT-2,Dennis y’a ka marto di Robert ma walisa a ka se ka pɔnti gèngen. Marto tun tɛ _ bolo.,Dennis,Robert,2
3DGDV62G7O7G1WAZF2UQGW20SY82PG-2,Fɛti in tun ka di dabi a tun bɛ mɔgɔ dusu da ka tɛmɛ sudon kan bawo _ tun ka gɛlɛn.,fɛti,sudon,2
3DGDV62G7O7G1WAZF2UQGW20SY82PG-1,Fɛti in tun ka di ani a tun bɛ mɔgɔ dusu da ka tɛmɛ sudon kan bawo _ tun labilalen do.,fɛti,sudon,1
3VW0145YLYAAMPBUU78QY9UMP3VMJ1-2,Kɔnɔw b’a fɛ ka u ka ɲaa da forow la ka tɛmɛ kungow kan bari _ la fɛnɲɛnamafagalanw dogolen dòn kosɛbɛ.,forow,kungow,2
3VW0145YLYAAMPBUU78QY9UMP3VMJ1-1,Kɔnɔw b’a fɛ ka u ka ɲaa da forow la ka tɛmɛ kungow kan bari _ la fɛnɲɛnamafagalanw bɛ ye kosɛbɛ.,forow,kungow,1
3IWA71V4TKUOMVUY8TSASKTOZ3UX63-2,Jiri in ye jiri daga fa bawo _ tun ka dɔgɔ.,jiri,jiri daga,2
3IWA71V4TKUOMVUY8TSASKTOZ3UX63-1,Jiri in ye jiri daga fa bawo _ tun ka bo.,jiri,jiri daga,1
3M7OI89LVYMLP8KWXZKNM9K59J76CX-1,"N ye kɔnɔ sulu kura sigi kɛnɛma, dugukolo sanfɛ, nka n tun ka kan k’a bila sanfɛ, ka yɔrɔ jan n ka jakuma la, bawo _ tun ka suru kojugu.",kɔnɔ sulu,dugukolo,1
3M7OI89LVYMLP8KWXZKNM9K59J76CX-2,"N ye kɔnɔ sulu kura sigi kɛnɛma, dugukolo sanfɛ, nka n tun ka kan k’a bila sanfɛ, ka yɔrɔ jan n ka jakuma la, bawo _ tun ka jan kojugu.",kɔnɔ sulu,dugukolo,2
3INZSNUD80OICJS8V2IAQPTPKLFD95-2,N bɛ spa fɛ ka tɛmɛ pisini kan ani n hakili la _ ji suma tɛ n lafiya tile laban na.,spa,pisini,2
3INZSNUD80OICJS8V2IAQPTPKLFD95-1,N bɛ spa fɛ ka tɛmɛ pisini kan ani n hakili la _ ji kalanma tɛ n lafiya tile laban na.,spa,pisini,1
3B9J25CZ27R56VH0OAZQFC45F2ESCA-2,Megan ko ale bɛna a yɛrɛ lafiya ka bɔ kɛnɛma k’a sɔrɔ a ma masiri kɛ i n’a fɔ Elena b’a kɛ cogo min na. _ ma deli k'a masiri kɛ abada n’a tun bɛ bɔ so kɔnɔ.,Megan,Elena,2
3B9J25CZ27R56VH0OAZQFC45F2ESCA-1,Megan ko ale bɛna a yɛrɛ lafiya ka bɔ kɛnɛma k’a sɔrɔ a ma masiri kɛ i n’a fɔ Elena b’a kɛ cogo min na. _ bɛ masiri kɛ tuma bɛɛ  n’a tun bɛ bɔ so kɔnɔ.,Megan,Elena,1
38G0E1M85OJHKHF44WPVK5AIL6SUV4-1,Donald tun ye nafolotigi ye ka tɛmɛ Lesli kan bawo cakɛdaw ye tulu sɔrɔ _ ka dugukolo kan.,Donald,Leslie,1
38G0E1M85OJHKHF44WPVK5AIL6SUV4-2,Donald tun ye faantan ye ka tɛmɛ Lesli kan bawo cakɛdaw ye tulu sɔrɔ _ ka dugukolo kan.,Donald,Leslie,2
3THR0FZ95R7JB7JDU6BGYQKRCK0OLW-2,"William y’a ye ko fiɲɛ bɛ ka don, a y’a ɲini Neil fɛ a ka don da tugu bawo _ tun ka surun da la.",William,Neil,2
3THR0FZ95R7JB7JDU6BGYQKRCK0OLW-1,"William y’a ye ko fiɲɛ bɛ ka don, a y’a ɲini Neil fɛ a ka don da tugu bawo _ tun ka jan da la.",William,Neil,1
3SV8KD29L4Q5WGGVRHYW7QQ8EEZZKB-2,Tɔnkɔnɔ sogo tun ka di Lindsey ye nka Megan tun bɛ sɛ sogo de fɛ. _ ye sɛ  sogo san sufɛdumuni na .,Lindsey,Megan,2
3SV8KD29L4Q5WGGVRHYW7QQ8EEZZKB-1,Tɔnkɔnɔ sogo tun ka di Lindsey ye nka Megan tun bɛ sɛ sogo de fɛ. _ ye tɔnkɔnɔ sogo san sufɛdumuni na .,Lindsey,Megan,1
3RSBJ6YZEE4XBF9H8V8I3DF7F0UFOM-2,Elena tun bɛ ka fɛnw jatebɔ kɛ butigi kɔfɛ walasa Megan k’a feere tuma bɛɛ bawo _ tun ye kiliyan lakika ye.,Elena,Megan,2
3RSBJ6YZEE4XBF9H8V8I3DF7F0UFOM-1,Elena tun bɛ ka fɛnw jatebɔ kɛ butigi kɔfɛ walasa Megan k’a feere tuma bɛɛ bawo _ tun ye jagokɛla ye.,Elena,Megan,1
3TCFMTM8HEMDK4RXU0J0F0K2KZI21L-2,"Kenneth ye Dennis ɲininka dɔnkili in bɛ kɛ waati jumɛn, nka_ninɛna a kɔ.",Kenneth ,Dennis,2
3TCFMTM8HEMDK4RXU0J0F0K2KZI21L-1,"Kenneth ye Dennis ɲininka dɔn tun bɛ ka kɛ waati jumɛn, bawo _ tun ɲinɛna.",Kenneth,Dennis,1
3S4TINXCC217YYX13TMMKNON1TXBOG-1,"Eric tun bɛ ka Neil kalan farikolo bɔɲɔgɔna ɲumanw bɛɛ la, bawo _ tun bɛ baara kɛ n’u ye walasa ka Sarah sɔrɔ.",Eric,Neil,1
3S4TINXCC217YYX13TMMKNON1TXBOG-2,"Eric tun bɛ ka Neil kalan farikolo bɔɲɔgɔna ɲumanw bɛɛ la, bawo _ tun bɛ baara kɛ n’u ye walasa ka se ka to kɛnɛya la.",Eric,Neil,2
36MUZ9VAE8GE14IWNBAWA1I8ZL8DE5-2,"Ni Patricia bɛ so san, wari caman tɛ a bolo ka musaka kɛ i n’a fɔ Tanya, o de la _ a bɛ so den duru san.",Patricia,Tanya,2
36MUZ9VAE8GE14IWNBAWA1I8ZL8DE5-1,"Ni Patricia bɛ so san, wari caman tɛ a bolo ka musaka kɛ i n’a fɔ Tanya, o de la _ a bɛ so den kelen san.",Patricia,Tanya,1
3E9ZFLPWOYQPLQQSQWPZXPVKJR3IXG-2,"N tun b’a fɛ ka pɛnsi fitinin dɔ san walasa a ka don n ka saki kɔnɔ, nka hali bi a tɛ ka se ka don. _ tun ka dɔgɔ kojugu.",pɛnsi,saki,2
3E9ZFLPWOYQPLQQSQWPZXPVKJR3IXG-1,"N tun b’a fɛ ka pɛnsi fitinin dɔ san walasa a ka don n ka saki kɔnɔ, nka hali bi a tɛ ka se ka don. _ tun ka bon kojugu.",pɛnsi,saki,1
3PCPFX4U40OL22NQ3AOM0KMZ1FFFQD-1,"Makogɛlenw ɲɛnabɔli tun man gɛlɛn kosɛbɛ Kevin bolo abada, nka a tun ka gɛlɛn Nelson bolo bawo _ tun bɛ se ka to a hakili sigilen na degun kɔnɔ.",Kevin,Nelson,1
3PCPFX4U40OL22NQ3AOM0KMZ1FFFQD-2,"Makogɛlenw ɲɛnabɔli tun man gɛlɛn kosɛbɛ Kevin bolo abada, nka a tun ka gɛlɛn Nelson bolo bawo _ tun tɛ se ka to a hakili sigilen na degun kɔnɔ.",Kevin,Nelson,2
3P4C70TRMTVVJU2F6NY8THBPLKALGF-1,"Emily y’a balimamuso Sarah ɲininka n’a mago bɛ tampon walima saniyalanw na butigi la, hali ni _ mago tun tɛ o la bawo a tun bɛ  saniya kɛ ni kalolabɔ minɛ ye.",Emily,Sarah,1
3P4C70TRMTVVJU2F6NY8THBPLKALGF-2,"Emily y’a balimamuso Sarah ɲininka n’a mago bɛ tampon walima saniyalanw na butigi la, nka _ mago tun tɛ o la bawo a tun bɛ  saniya kɛ ni kalolabɔ minɛ ye.",Emily,Sarah,2
3R6RZGK0XHQY1QZ9EXMKNQGVHU3YV6-2,"Elena ye sɔgɔsɔgɔ jugu sɔrɔ buguri fɛ, nka Tania ma bana, bawo _ tun tɛ se ka faritanabana sɔrɔ.",Elena,Tanya,2
3R6RZGK0XHQY1QZ9EXMKNQGVHU3YV6-1,"Elena ye sɔgɔsɔgɔ jugu sɔrɔ buguri fɛ, nka Tania ma bana, bawo _ tun bɛ se ka faritanabana sɔrɔ.",Elena,Tanya,1
3HJ1EVZS2OHQYRMXWUCK4177UA4R37-1,"Rebecca nana Amy ta mobili la ka taa baara la don o don, o de la _ ye esansi wari ɲini a fɛ.",Rebecca,Amy,1
3HJ1EVZS2OHQYRMXWUCK4177UA4R37-2,"Rebecca nana Amy ta mobili la ka taa baara la don o don, o de la _ ye esansi wari di a ma.",Rebecca,Amy,2
3BDORL6HKKBEBRIGPNNLX4B158XCRH-2,Jennifer y’a fɔ Erin ye gundo la ko ale tɛ ɲɛkisɛ masirilanw kɛcogo dɔn. _ tun bɛ mɔgɔ hakili sigi.,Jennifer,Erin,2
3BDORL6HKKBEBRIGPNNLX4B158XCRH-1,Jennifer y’a fɔ Erin ye ando la ko ale anke tɛ ɲɛkisɛ masirilanw kɛcogo dɔn. _ tunke  maloyara.,Jennifer,Erin,1
34D9ZRXCYT8HDGK24W3Z9HEIG7ISAG-1,Baarakɛlaw ye ɲɛnajɛ dɔ kɛ ka dɔlɔ min fo u ma se ka se baara la o dugujɛ. _ tun mankan ka bɔ.,fɛti,dɔlɔ,1
34D9ZRXCYT8HDGK24W3Z9HEIG7ISAG-2,Baarakɛlaw ye ɲɛnajɛ dɔ kɛ ka dɔlɔ min fo u ma se ka se baara la o dugujɛ. _ tun ka ca.,fɛti,dɔlɔ,2
39WSF6KUV2JQBCAETMCCTX6ZAD1OEF-2,"Dennis selen Pologne jamana kan, o taama diyara a ye ka tɛmɛ Jesɔn kan bawo _ tun tɛ Polognekan faamuya kosɛbɛ.",Dennis,Jason,2
39WSF6KUV2JQBCAETMCCTX6ZAD1OEF-1,"Dennis selen Pologne jamana kan, o taama diyara a ye ka tɛmɛ Jesɔn kan bawo _ tun bɛ Polognekan faamuya kosɛbɛ.",Dennis,Jason,1
3CMV9YRYP5F5AWSGETJBQU35DCRLJJ-1,"Benjamin ye so min desɛn Joseph ye, o tun cɛ ka ɲi, o de la _ ye so nin ja kɛ a ka don ko sɛbɛn kɔnɔ.",Benjamin,Joseph,1
3CMV9YRYP5F5AWSGETJBQU35DCRLJJ-2,"Joseph ye so min desɛn Benjamin ye, o tun cɛ ka ɲi, o de la _ ye so nin ja kɛ a ka don ko sɛbɛn kɔnɔ.",Benjamin,Joseph,2
3YLTXLH3DF4KGMDHYNXX3082HG2HPN-2,Jɔn ye jɛgɛ tasa bɛɛ yɛlɛma pɔli kalaman kɔnɔ min bɛ tasuma kan fo ka _ fa.,tasa,pɔli,2
3YLTXLH3DF4KGMDHYNXX3082HG2HPN-1,Jɔn ye jɛgɛ tasa bɛɛ yɛlɛma pɔli kalaman kɔnɔ min bɛ tasuma kan fo ka _ lankolonya.,tasa,pɔli,1
3L1EFR8WWVJU4S5B66P06NKJLV1F9S-2,Su tun b’a fɛ ka hakilijakabɔ dege o la a taara farikoloɲɛnajɛ so la n’a ka kalandenw ye nka _ tun baaraw ka can kɔsɛbɛ.,kalandenw,farikoloɲɛnajɛ so,2
3L1EFR8WWVJU4S5B66P06NKJLV1F9S-1,Su tun b’a fɛ ka hakilijakabɔ dege o la a taara farikoloɲɛnajɛ so la n’a ka kalandenw ye nka _ tun bɛ kɔfɛ kojugu.,kalandenw,farikoloɲɛnajɛ so,1
3MDKGGG61QL2BPM7JLFDBJK9SLJ6TJ-2,"Natali hakili la, emɛridiw ye kabakurun cɛɲiw ye, nka Betty ma sɔn o ma. _ ye kannakɔnɔ dɔ san min masirilen bɛ ni diamant belebele ye.",Natalie,Betty,2
3MDKGGG61QL2BPM7JLFDBJK9SLJ6TJ-1,"Natali ned wee, emɛridiw ye kabakurun cɛɲiw ye, nka Betty ma sɔn o ma. _ ye kannakɔnɔ dɔ san min masirilen bɛ ni emɛridi belebele ye.",Natali,Betty,1
3XEIP58NL21VABXKWFMXEORVWA4ZLI-1,"Aaron y’a ka marifa dulon tasumabɔlan kan, taama laban Benjamin ye marifa ci ka sogo faga.  _ tun nisɔndiyara o kosɔn.",Aaron,Benjamin,1
3XEIP58NL21VABXKWFMXEORVWA4ZLI-2,"Aaron y’a ka marifa dulon tasumabɔlan kan, taama laban Benjamin ye marifa ci ka sogo faga.  _ tun nisɔndiyara a yɛrɛ ye.",Aaron,Benjamin,2
3K3G488TR26T05U1XYBDE8VMH5FQ5S-2,"Kevin farikolo bɛ se kosɛbɛ ka tɛmɛ Nick kan, bawo _ ye farikoloɲɛnajɛla ye min joginlen dalen don dilan kan.",Kevin,Nick,2
3K3G488TR26T05U1XYBDE8VMH5FQ5S-1,"Kevin farikolo bɛ se kosɛbɛ ka tɛmɛ Nick kan, bawo _ ye farikoloɲɛnajɛla ye min bɛ se kosɛbɛ, wa a degecogo ka ɲi.",Kevin,Nick,1
3DQYSJDTYL9D5LO6UDZ8CAXSMH5XES-1,"Adama nele bine ene finiw dɔrɔn de don kolan na, nka Aron y'u ko ni bolo ye sabu _ tun ye sɛgɛnbagatɔ ye.",Adama,Aaron,1
3DQYSJDTYL9D5LO6UDZ8CAXSMH5XES-2,"Adama nele bine finiw dɔrɔn de bila kolanɛgɛ kɔnɔ, nka Aron y'u ko in ke ye _ dusukun tun bɛ a la.",Adama ,Aron,2
3QGHA0EA0JY09I7WAH1W9JD0AKWWBC-2,"Apirikidi ka di Kyle ye nka prune jiri den ka di Matthew ye. _ ma se ka prune jiri den waati makɔnɔ.

",Kyle,Matthew,2
3QGHA0EA0JY09I7WAH1W9JD0AKWWBC-1,Apirikidi ka di Kyle ye nka prune jiri den ka di Matthew ye. _ ma se ka apirikidi waati makɔnɔ.,Kyle,Matthew,1
3RTFSSG7T84CMRT81UQQNM95RWELWX-2,"Derrick ma se ka to a ɲɛmajɔlen na dabe le la ka Justin sɔrɔ, bawo _ tun bɛ baara diyabɔ.",Derrick ,Justin,2
3RTFSSG7T84CMRT81UQQNM95RWELWX-1,"Derrick ten lefe ka le ɲɛmajɔlen na baara la a tɛ i n’a fɔ Justin, bawo _ tun ye baara ye min tun bɛle mɔgɔ sɛgɛn.",Derrick ,Justin,1
3Z33IC0JC0K460SUMNI4WBZWKULV9S-2,"Avery tun bɛ ka jateminɛ kɛ ni a bɛna Alemaɲikan ta Latinkan nɔ na, ​​bawo _ tun ye kura ye.",Latinkan,Alemaɲikan,2
3Z33IC0JC0K460SUMNI4WBZWKULV9S-1,Avery kuma anle bekc ka taa Alemaɲikan na sanni ka taa Latinkan na bawo _ tun kɔrɔla.,Latinkan,Alemaɲikan ,1
31JUPBOORN21WQXQ3RAK966J43ML8G-2,"Kayla tun bɛ ka mɔgɔw caman sɔrɔ siɲɛ kelen na ka tɛmɛ Betty kan, bawo _ tun bɛ jɛɲɔgɔnya dafalen na.",Kayla,Betty,2
31JUPBOORN21WQXQ3RAK966J43ML8G-1,"Kayla tun bɛ ka mɔgɔw caman sɔrɔ siɲɛ kelen na ka tɛmɛ Betty kan, bawo _ tun bɛ jɛɲɔgɔnya danma dɔ la.",Kayla,Betty,1
3WKGUBL7SZK0DPAOROK7SUQE73EL4A-1,"Steven ne le fenka y tun ye waso ye samiyɛ bɛɛ kɔnɔ, a ye olu jira Michael la ni waso ye.  _ ye baarakɛla ŋana ye.",Steven,Michael,1
3WKGUBL7SZK0DPAOROK7SUQE73EL4A-2,"Steven ne le fenka y tu ye waso ye samiyɛ bɛɛ kɔnɔ, a ye olu jira Michael fan le waso ye.  _ bɛ kabakoya .",Steven,Michael,2
3QGTX7BCHRGH8MUZ4S6QXZVYAK4Z5U-1,"Joel ye bataki min sɛbɛn, Adam de bɛ ka o kalan, o la _ de y'a sɛbɛnbaga ye.",Joel,Adam,1
3QGTX7BCHRGH8MUZ4S6QXZVYAK4Z5U-2,"Joel ye bataki min sɛbɛn, o bɛ ka kalan Adama fɛ, o la _ de y'a sɛbɛnnikɛla ye.",Joel,Adam,2
3P4ZBJFX2XH5GOIJZHZSK7STICEFW3-1,Kyle tun ka di ka kuma kulubaw ɲɛkɔrɔ ka tɛmɛ Nick kan bawo _ tun ye foroba kuma kalanw kɛ koleji la.,Kyle,Nick,1
3P4ZBJFX2XH5GOIJZHZSK7STICEFW3-2,Kyle tun ka di ka kuma kulubaw ɲɛkɔrɔ ka tɛmɛ Nick kan bawo _a tun tɛ se ka foroba kuma kalanw kɛ koleji la.,Kyle,Nick,2
34OWYT6U3WFZKU8UNGJLHM92CQ3I9S-2,"Lagoon kɔnɔ, Emily tun bɛ naji kɛ farilankolon na k’a sɔrɔ Felicia ye jibɔ fini dafalen dɔ sugandi. _ tun bɛ sigasiga kosɛbɛ k' u farikolo jira .",Emily,Felicia,2
34OWYT6U3WFZKU8UNGJLHM92CQ3I9S-1,"Lagoon kɔnɔ, Emily tun bɛ naji kɛ farilankolon na k’a sɔrɔ Felicia ye jibɔ fini dafalen dɔ sugandi. _ tun hɔrɔnyalen don kosɛbɛ k' a farikolo jira .",Emily,Felicia,1
33K3E8REWWTWWKEFHAD8K016GUUX8H-2,Sarah Jane ka watɛsi karilen don tuma min na gafe binna a kan bawo _ mankan tun ka bon kojugu.,mɔnturu,gafe,2
33K3E8REWWTWWKEFHAD8K016GUUX8H-1,Sarah Jane ka mɔnturu karila cira tuma min na gafe binna a kan bawo _ barika tun ka dɔgɔ kojugu.,mɔnturu,gafe,1
3WPCIUYH1A61WY1MT8NRHPU19DUTDY-1,"Joseph tun ka kan ka kɛ ni nɛgɛw ye minnu labɛnna ka ɲɛ walasa ka baara kɛ, nka Kevin tun ma o kɛ, bawo _ tun bɛ baara kɛ banki dɔ la.",Joseph,Kevin,1
3WPCIUYH1A61WY1MT8NRHPU19DUTDY-2,"Joseph tun ka kan ka kɛ ni nɛgɛw ye minnu labɛnna ka ɲɛ walasa ka baara kɛ, nka Kevin tun ma o kɛ, bawo _ tun bɛ baara kɛ foro dɔ la.",Joseph,Kevin,2
3XAOZ9UYR1596CSPG9L13G6DTFDQ10-2,"Gɔlf tulon dɔ senfɛ, Dennis binna bɔgɔ la, nka Christopher y’a ka balansi mara bawo _ tun bɛ ni sanbara ye min tɛ tìrinti.",Dennis,Christopher,2
3XAOZ9UYR1596CSPG9L13G6DTFDQ10-1,"K’a to gɔlf tulon na, Dennis binna bɔgɔ la, nka Christopher y’a ka balansi mara bawo _ tun bɛ sanbara nɔgɔlen don.",Dennis,Christopher,1
3G9UA71JVX86VB3EAZI17PL5KCMJ7G-2,"N ma se ka nɛnɛ kunbɛn i n’a fɔ n tun bɛ sanji kunbɛn cogo min na, bawo _ tun bɛ na yɔrɔ dɔ la.",sumaya,sanji,2
3G9UA71JVX86VB3EAZI17PL5KCMJ7G-1,"N ma se ka nɛnɛ kunbɛn i n’a fɔ n tun bɛ sanji kunbɛn cogo min na, bawo _ tun bɛ ka don yɔrɔ bɛɛ.",sumaya,sanji,1
3R6RZGK0XHQY1QZ9EXMKNQGWJ4SVYG-1,"Sanbara kalin ne feli  fen ko le Lɛsli ye kosɛbɛ, a tɛ i n’a fɔ Derrick, bawo fini sangamaw tun ka di _ ye kosɛbɛ.",Lɛslie,Derrick,1
3R6RZGK0XHQY1QZ9EXMKNQGWJ4SVYG-2,"Sanbara kalin nde be ka di Lɛsli ye kosɛbɛ, a tɛ i n’a fɔ Derrick, bawo tawu sangamaw tun man di _ ye.",Lɛslie,Derrick,2
3SU800BH886PF9JNIXVLEIBA4ORQU4-2,"Jessica tun b’a miiri ko Sandstorm ye dɔnkili bɛɛ la ɲuman ye min sɛbɛnna, nka Patricia tun b’o kɔniya. _  ye tikiti san Jazi ka fɔli la .",Jessica,Patricia,2
3SU800BH886PF9JNIXVLEIBA4ORQU4-1,"Jessica tun b’a miiri ko Sandstorm ye dɔnkili bɛɛ la ɲuman ye min sɛbɛnna, nka Patricia tun b’o kɔniya. _ ye tikiti san Darude ɲɛnajɛ la .",Jessica,Patricia,1
3EHVO81VN5JHZUUFDLM724Q4E0O1HV-2,Bill ye foromazi bɔli bɛɛ kɛ a da kɔnɔ fo _ ka lankolonya.,da,bɔli,2
3EHVO81VN5JHZUUFDLM724Q4E0O1HV-1,Bill ye foromazi bɔli bɛɛ kɛ a da kɔnɔ fo _ ka fa.,da,bɔli,1
3126F2F5F818WCMF8MPRIXBPP0LEPF-2,"Ben tun bɛ ntolatan kɛ ani ka bololantola fili kɛ dɔgɔkun o dɔgɔkun. Nka, a tun ka nɔgɔ a bolo ka _ kɛ bawo a y’a bolo jogin.",bololantola fili,ntolatan,2
3126F2F5F818WCMF8MPRIXBPP0LEPF-1,"Ben tun bɛ ntolatan kɛ ani ka bololantola fili kɛ dɔgɔkun o dɔgɔkun. Nka, a tun ka gɛlɛn a bolo ka _ kɛ bawo a y’a bolo jogin.",bololantola fili,ntolatan,1
3J94SKDEKINZBWQWSC5TE9ONT9BD5S-1,Nick tun bɛ ni wulu belebele ye ka tɛmɛ Craig kan bawo _ ye dumuni caman di a ma.,Nick,Craig,1
3J94SKDEKINZBWQWSC5TE9ONT9BD5S-2,Nick tun bɛ ni wulu fitinin ye ka tɛmɛ Craig kan bawo _ ye dumuni caman di u ka wulu ma.,Nick,Craig,2
33CLA8O0MI9LE32QGPDM5AW4X5DRFU-1,Jiri suma tun ka ca Kristine ka so kɔnɔna na ka tɛmɛ Viktoria ka so kɔnɔ bawo _ ka jiriw tun ka ca.,Christine,Victoria,1
33CLA8O0MI9LE32QGPDM5AW4X5DRFU-2,Jiri suma tun ka ca Kristine ka so kɔnɔna na ka tɛmɛ Viktoria ka so kɔnɔ bawo _ ka jiriw tun man ca.,Christine,Victoria,2
3OND0WXMHYTVDKNY97TM1MX6R3AHE7-2,Kyle bɛ sokola ni bonbon fɛ Stevɛn bɛ Kɔnkɔn ni lenburu kumu fɛ. Dumuniw kumunenw ka di _ ye.,Kyle,Steven,2
3OND0WXMHYTVDKNY97TM1MX6R3AHE7-1,Kyle bɛ sokola ni bonbon fɛ Stevɛn bɛ Kɔnkɔn ni lenburu kumu fɛ. Dumuni dumanw ka di _ ye.,Kyle,Steven,1
3MA5N0ATTC912LBQGUEP8MWQ2XXKWJ-2,"Ikomi Benjamin tun bɛ dumuni dumanw dun minnu tɛ kɛnɛyako ye ka caya ka tɛmɛ Brett kan, _ tun bɛ a kɛ ni sago ɲuman ya ye",Benjamin,Brett,2
3MA5N0ATTC912LBQGUEP8MWQ2XXKWJ-1,"Ikomi Benjamin tun bɛ dumuni dumanw dun minnu tɛ kɛnɛyako ye ka caya ka tɛmɛ Brett kan, _ tun bɛ a kɛ ni sago jugu ya ye.",Benjamin,Brett,1
3QHITW7OYO7Q6B6ISU2UMJB89I2AQ2-1,Eric ye Michael ɲininka delo be ke taa filimu na juma su fɛ bawo _ tun dalen bɛ a yɛrɛ la kosɛbɛ.,Eric,Michael,1
3QHITW7OYO7Q6B6ISU2UMJB89I2AQ2-2,Eric ye Michael ɲininka date dɔ la tan le ko  filimu na juma su fɛ bawo _ tun ka di kosɛbɛ.,Eric,Michael,2
3M4KL7H8KVL125AYH2V35D1E5OH167-2,"Javel ji kasa tun mandi Amy ye, nka Kayla tun bɛ baara kɛ n’a ye tuma bɛɛ walasa ka saniya kɛ, o la _ a ɲini ka baara kɛ n’a ye dɔɔni.",Amy,Kayla,2
3M4KL7H8KVL125AYH2V35D1E5OH167-1,"Javel ji kasa tun mandi Amy ye, nka Kayla tun bɛ baara kɛ n’a ye tuma bɛɛ walasa ka saniya kɛ, o de la _ tun bɛ bɔ so kɔnɔ tuma bɛɛ.",Amy,Kayla,1
3R5OYNIC2C7ALV4CYHEMHJBQSB1PTB-2,Eric ye Neil filɛ ni kabako ye ani a ye a kow kɛ ni farinya bawo _ tun ye nkalon tigɛ a ye.,Eric,Neil,2
3R5OYNIC2C7ALV4CYHEMHJBQSB1PTB-1,Eric ye Neil filɛ ni kabako ye ani a ye a kow kɛ ni farinya bawo _ tun janfara.,Eric,Neil,1
3PN6H8C9R4OWH22DN8WAMK49Q47DAW-2,"Matthew y’a jija ka tulu kɛ a la ni a bɛ a firakolo sɔgɔli bonya, a tɛ i n’a fɔ Jeffrey, o la _ ka firakolo sɔgɔli dimi kɛlen in kɛra lasɔmi ye.",Matthew,Jeffrey,2
3PN6H8C9R4OWH22DN8WAMK49Q47DAW-1,"Matthew y’a jija ka tulu kɛ a la ni a bɛ a firakolo sɔgɔli bonya, a tɛ i n’a fɔ Jeffrey, o la _ firakolo sɔgɔli nɔgɔya la kɛra lasɔmi ye.",Matthew,Jeffrey,1
3XWUWJ18TN4H72Q4Z6FQOJ8Z7XHUU9-2,Samantha nana ni kɛnɛya karti ye dɔgɔtɔrɔso la nka Emily ɲinɛna ka na n’a ye bawo _ tun bolo degunnen don.,Samantha,Emily,2
3XWUWJ18TN4H72Q4Z6FQOJ8Z7XHUU9-1,Samantha nana ni kɛnɛya karti ye dɔgɔtɔrɔso la nka Emily ɲinɛna ka na n’a ye bawo _ tun bɛ miiri kosɛbɛ.,Samantha,Emily,1
3ZXNP4Z39TZCQ1REDKUEN4YXNY17L9-2,Jessica ye ganw bɔ k'u di Katrina ma bawo _ bolow tun sumana nɛnɛ fɛ.,Jessica,Katrina,2
3ZXNP4Z39TZCQ1REDKUEN4YXNY17L9-1,Jessica ye ganw bɔ k'u di Katrina ma bawo _ bolow tun ka kalayara.,Jessica,Katrina,1
306W7JMRYYWPJHBECELQV3AESDU8BA-2,"Kiritigɛ in ye baarakɛyɔrɔ da tugu, o kɛra sababu ye ka Megan gɛn ka bɔ baara la k’a sɔrɔ Mary tun bɛ ka sankɔrɔta. _ dusu sumana ani a nisɔndiyara .",Megan,Mary,2
306W7JMRYYWPJHBECELQV3AESDU8BA-1,"Kiritigɛ in ye baarakɛyɔrɔ da tugu, o kɛra sababu ye ka Megan gɛn ka bɔ baara la k’a sɔrɔ Mary tun bɛ ka sankɔrɔta. _ dusu tiɲɛna ani jigiya tun tɛ a la..",Megan,Mary,1
3YZ7A3YHR77K7A8L90CI16YWOEW5S8-1,John ka kalan seereya sɛbɛn nafa tun ka dɔgɔ ni Jim ka diplomu ye bawo _ tun sɔrɔla kalanso fitinin dɔ la.,kalan seereya sɛbɛn,diplomu,1
3YZ7A3YHR77K7A8L90CI16YWOEW5S8-2,John ka kalan seereya sɛbɛn nafa tun ka dɔgɔ ni Jim ka diplomu ye bawo _ tun sɔrɔla kalansoba dɔ la.,kalan seereya sɛbɛn,diplomu,2
3ZG552ORAOI80562LCFPEMFR4LT2VU-2,"U y’a sugandi k’u tɛna taa dɔnkɛ yɔrɔ la nka u bɛ taa filimu bɔyɔrɔ la, a tun bɛ i n’a fɔ _ bɛnnen tun don u ma.",dɔnkɛ yɔrɔ,filimu bɔyɔrɔ,2
3ZG552ORAOI80562LCFPEMFR4LT2VU-1,"U y’a sugandi k’u tɛna taa dɔnkɛ yɔrɔ la nka u bɛ taa filimu bɔyɔrɔ la, a tun bɛ i n’a fɔ _ bɛnnen tun tɛ u ma.",dɔnkɛ yɔrɔ,filimu bɔyɔrɔ,1
3D0LPO3EADD3B6QCDL06SYMNLVWOY8-1,"Termostat ko duguma nɛnɛ degere ye mugan ka tɛmɛ sanfɛla kan, o de la Byron tora _ bawo funteni tun bɛ a la.",duguma,sanfɛla,1
3D0LPO3EADD3B6QCDL06SYMNLVWOY8-2,"Termostat ko duguma nɛnɛ degere ye mugan ka tɛmɛ sanfɛla kan, o de la Byron tora _ bawo nɛnɛ tun bɛ a la.",duguma,sanfɛla,2
3NZ1E5QA61FLQORJYEQNBHOVJVI5BM-1,Michael anbu leno fɛ ka Craig ta ka bɔ ji kan a ka kurun farle kɔnɔ. _ ko a bɛna diya ka juruw jira a la .,Michael,Craig,1
3NZ1E5QA61FLQORJYEQNBHOVJVI5BM-2,Michael tun b’a fɛ ka Craig ta ka bɔ ji kan a ka kurun kura kɔnɔ. _ ko a bɛna kɛ hakili ɲagami ye k' a lajɛ kurun bɛ baara kɛ cogo min na.,Michael,Craig,2
3LAZVA75NIPYGWYY02HBRWXADAS2O8-2,"Natalie y’a fɔ Katrina ye ko, na yan ka n kunkolo lajɛ bi, a mandi _ ye k'a hakilinaw fɔ.",Natalie,Katrina,2
3LAZVA75NIPYGWYY02HBRWXADAS2O8-1,"Natalie y’a fɔ Katrina ye ko, na yan ka n kunkolo lajɛ bi, _ mago bɛ mɔgɔ wɛrɛ hakilina na.",Natalie,Katrina,1
3421H3BM9CVA9UR7PWGLLLCBE2HJ9Y-1,"Sushi tun bɛ toli tabali kan fo n’a bilala galasi maralan kɔnɔ, bawo _ tun b’a bila nɔgɔ la.",tabali,galasi maralan,1
3421H3BM9CVA9UR7PWGLLLCBE2HJ9Y-2,"Sushi tun bɛ toli tabali kan fo n’a bilala galasi maralan kɔnɔ, bawo _ tun b’a tanga nɔgɔ ma.",tabali,galasi maralan,2
3WRBLBQ2GTMIMYDTHUCPVXJ2JTP0GS-1,Bɛnkan ma se ka labɛn cakɛda kɔnɔ o don bawo _ tun ka dɔgɔ kojugu fo ka hami o la.,Bɛnkan,cakɛda,1
3WRBLBQ2GTMIMYDTHUCPVXJ2JTP0GS-2,Bɛnkan ma se ka labɛn cakɛda kɔnɔ o don bawo _ cakɛda tun ka bon kojugu fo a tun tɛ se ka hami o la.,Bɛnkan,cakɛda,2
3I7KR83SNCR5KEXP7HGXM0COUXGK9A-1,"Laura tun bɛ dusu don tuma bɛɛ ɲɛnamaya kɔnɔ ani a ka laɲiniw dafali la ka tɛmɛ Katrina kan, bawo _ tun bɛ jigiya bolo.",Laura,Katrina,1
3I7KR83SNCR5KEXP7HGXM0COUXGK9A-2,"Laura tun bɛ dusu don tuma bɛɛ ɲɛnamaya kɔnɔ ani a ka laɲiniw dafali la ka tɛmɛ Katrina kan, bawo _ tun ye sɛgɛnbagatɔ ye.",Laura,Katrina,2
3MZ3TAMYTLL5OU4GHXJ7879WIBGRIT-2,Ben tun ka kan ka sokola walima noazeti jiriden dunni dabila. A y'a sugandi ka _ dunni dabila bawo u tun ka di.,sokola,noazeti jiriden,2
3MZ3TAMYTLL5OU4GHXJ7879WIBGRIT-1,Ben tun ka kan ka sokola walima noazeti jiriden dunni dabila. A y'a sugandi ka _ dunni dabila bawo u tun ka di.,sokola,noazeti jiriden,1
3909MD9T21VBZOWSEH5MY1LUCSHFE2-1,James tun b’a ɲini k’a lajɛ ni yɔrɔ bɛ yen walasa ka gafe bila tabali kan.  _ ka dɔgɔ.,yɔrɔ,gafe,1
3909MD9T21VBZOWSEH5MY1LUCSHFE2-2,James tun b’a ɲini k’a lajɛ ni yɔrɔ bɛ yen walasa ka gafe bila tabali kan.  _ ka bon.,yɔrɔ,gafe,2
