qID,Sentence,Option1,Option2,Answer
35ZRNT9RUIWN1EUH42VGA622JTGO33-2,"Lawrence tun ye kalanbaga ŋana ye, a tun bɛ nsiirinw kalan k’a sɔrɔ Jason tun bɛ nsiirinw kalan minnu tɛ nsiirinw ye. _ ye gɛlɛya sɔrɔ ka boli ka don diɲɛ kɔnɔ min ye fɛn ye min bɛ mɔgɔ bila ka miiri.",Lawrence,Jason,2
3P888QFVX3SF8F0J2D7CNEVDYXFOQK-1,"Mary tun bɛ fini ŋɛgɛnenw dɔrɔn de don ka taa baara la, a tun tɛ fini datugulen don bawo _ tun b’a yeko kɛ i n’a fɔ a labilalen do.",fini ŋɛgɛnenw,fini datugulen,1
3P888QFVX3SF8F0J2D7CNEVDYXFOQK-2,"Mary tun bɛ fini ŋɛgɛnenw dɔrɔn de don ka taa baara la, a tun tɛ datugulen don bawo _ y’a kɛ i n’a fɔ a ye baarakɛla ye.",fini ŋɛgɛnenw,fini datugulen,2
3IZVJEBJ6CYDRQUD9BGVP59Y6LBZ6I-2,Mobili parasɔk tun bɛ manamana ka tɛmɛ mobili da yɛlɛlan kan bawo _ tun nɔgɔlen don.,parasɔk,da yɛlɛlan,2
3IZVJEBJ6CYDRQUD9BGVP59Y6LBZ6I-1,Mobili parasɔk tun bɛ manamana ka tɛmɛ mobili da yɛlɛlan kan bawo _ tun saniyalen don.,parasɔk,da yɛlɛlan,1
3ECKRY5B1SATKAPEBCPKM8Z4GNJZIE-2,Ian bɛ pisini ɲɛnajɛ dɔ fili Neil ye ani a ka kan ka jidagayɔrɔ pH kɔrɔta walasa _ ka se ka ɲɛnajɛ diyabɔ lafiya la.,Ian,Neil,2
3ECKRY5B1SATKAPEBCPKM8Z4GNJZIE-1,"Ian bɛ ka pisini ɲɛnajɛ dɔ fili Neil ye, wa a mago bɛ ka pH kɔrɔta pisini dɔ la, o de la _ bɛ pH kɔrɔta furakisɛ dɔw san.",Ian,Neil,1
302U8RURJ1F4PRVV7VD96AIOD98VNK-2,"K’a sɔrɔ Billie nana ni kiriyɔn ye, ne taara ni dɔ ye ka taa so feerela ka biro la. N ye n ka sɛbɛnnikɛlan di Billie ma ani a nisonjalen ye _ kɛ ka a bolonɔ bila sɛbɛn in na.",kiriyɔn,sɛbɛnnikɛlan,2
302U8RURJ1F4PRVV7VD96AIOD98VNK-1,"K’a sɔrɔ Billie nana ni kiriyɔn ye, ne taara ni dɔ ye ka taa so feerela ka biro la. N ye n ka sɛbɛnnikɛlan di Billie ma nka a ye baara kɛ ni _  ye ni kɔnɔnajɛya ye walasa ka a bolonɔ bila sɛbɛn in na.",kiriyɔn,sɛbɛnnikɛlan,1
3C8QQOM6JRF9FL8AWBYBETO62IMLI1-1,Mɔgɔ si ma se ka maana in waleɲumandɔn ani an y’a daminɛ ka dɔnkiliw lamɛn. _ bɛ mɔgɔ tɔrɔ.,maana,dɔnkili,1
3C8QQOM6JRF9FL8AWBYBETO62IMLI1-2,Mɔgɔ si ma se ka maana in waleɲumandɔn ani an y’a daminɛ ka dɔnkiliw lamɛn. _ ka di.,maana,dɔnkili,2
37VUR2VJ6C35CBI6BRK6JBHXRC41CQ-2,Katrina ɲinw bɛ jɛ ka tɛmɛ Laura ta kan bawo _ bɛ ji min kosɛbɛ tuma bɛɛ.,Katrina,Laura,2
37VUR2VJ6C35CBI6BRK6JBHXRC41CQ-1,Katrina ɲinw bɛ jɛ ka tɛmɛ Laura ta kan bawo _ bɛ kafe min kosɛbɛ tuma bɛɛ.,Katrina,Laura,1
3P4C70TRMTVVJU2F6NY8THBPLQ7LGO-1,A tun ka kan ka nɛgɛ gosi ni marito sɔgɔlilan ye _ sumayalen kɔfɛ.,nɛgɛ,marito sɔgɔlilan,1
3P4C70TRMTVVJU2F6NY8THBPLQ7LGO-2,I tun ka kan ka nɛgɛ gosi ni marito sɔgɔlilan ye sanni _ ka sumaya.,nɛgɛ,marito sɔgɔlilan,2
3I7SHAD35OAWWJ9ZDWVTNHDLMYLM77-2,"Kevin ma musakaw jate tuma min na u ye so san Derrick fɛ, o de la _ ye wari dingɛ bɔ.",Kevin,Derrick,2
3I7SHAD35OAWWJ9ZDWVTNHDLMYLM77-1,"Kevin ma musakaw jate tuma min na u ye so san Derrick fɛ, o de la _ y’a yɛrɛ sɔrɔ wari dingɛ dɔ kɔnɔ.",Kevin,Derrick,1
371DNNCG440PF35VC0CBVXG033L8TY-2,Robert ye dɛmɛ don ka Kyle ka ɛntɛrinɛti videyo sensation viral dɔ dabɔ tuma min na _ tun bɛ dɔn kɛ videyo kan.,Robert,Kyle,2
371DNNCG440PF35VC0CBVXG033L8TY-1,Robert ye dɛmɛ don ka Kyle ka ɛntɛrinɛti wideyow sensation viral dilan tuma min na _ ye o wideyow dilan.,Robert,Kyle,1
3DZKABX2ZKJLYNY4I54VQZOCEQLCVG-2,"Rebecca ye Maria wele ka na kɔnsɛri dɔ la, o kɔfɛ, _ tun ka kan ka yamaruya sɔrɔ u bangebagaw fɛ walasa ka taa o la.",Rebecca,Maria,2
3DZKABX2ZKJLYNY4I54VQZOCEQLCVG-1,"Rebecca welera ka na kɔnsɛri dɔ la Maria fɛ, o kɔfɛ _ tun ka kan ka yamaruya sɔrɔ u bangebagaw fɛ walasa ka taa o la.",Rebecca,Maria,1
30P8I9JKOIJL5DQIJX5NKVUUTHCV58-2,Ani sera fina Betty ka tuganin minɛ ka mɛn ka tɛmɛ Angela kan bawo _ bɛ siran kɔnɔw ɲɛ.,Betty ,Angela,2
30P8I9JKOIJL5DQIJX5NKVUUTHCV58-1,Betty ne ledo tuganin minɛ ka mɛn ka tɛmɛ Angela kan bawo _ tun tɛ anife kɔnɔw ɲɛ.,Betty ,Angela,1
38XPGNCKHVEI3JLPPQYD71COMD44VV-2,"Nick bɛ nɛ caman bɔ, k’a sɔrɔ Jason ma deli ka hali jock strap don. _ ye dɔnkilidala ye.",Nick,Jason,2
38XPGNCKHVEI3JLPPQYD71COMD44VV-1,"Nick bɛ nɛ caman bɔ, k’a sɔrɔ Jason ma deli ka hali jock strap don. _ ye farikoloɲɛnajɛla ye.",Nick,Jason,1
39AYGO6AFFI4GCHNMPT12KEH8NL6NF-2,"Jill ye samalikɛ mana min san, o tun tɛ bɛn a sen ma, _ tun ka bon kojugu.",samalikɛ mana,sen,2
39AYGO6AFFI4GCHNMPT12KEH8NL6NF-1,"Jill ye samalikɛ mana min san, o tun tɛ bɛn a sen ma, _ tun ka dɔgɔ kojugu.",samalikɛ mana,sen,1
3IVKZBIBJ2NWN3SGA2DRQ31MTY2SHD-2,James ma se ka saki datugu k’a sababu kɛ finiw ye minnu tun bɛ a kɔnɔ. _ ka dɔgɔ.,fini,saki,2
3IVKZBIBJ2NWN3SGA2DRQ31MTY2SHD-1,James ma se ka saki datugu k’a sababu kɛ finiw ye minnu tun bɛ a kɔnɔ. _ ka ca.,fini,saki,1
3HJ1EVZS2QX5SGL4GSOKWZVGPWV3RY-2,"Michelle y’a ka bisiki dilan k'a surunya wa tulu t'a la fewu, bawo a tun b’a miiri ko _ bɛ a dun ja.",tulu,dɔgɔyali,2
3HJ1EVZS2QX5SGL4GSOKWZVGPWV3RY-1,"Michelle y’a ka bisiki dilan k'a surunya wa tulu t'a la fewu, bawo a tun b’a miiri ko _ bɛ a girinya kojugu.",tulu,dɔgɔyali,1
3TLFH2L6Y9METO36WJ3AL63XH3TT2G-1,"Dennis taara lafiɲɛbɔ la, Nelson tora so, o la sa, salati min tun bɛ _ ka frigo kɔnɔ, o toli.",Dennis,Nelson,1
3TLFH2L6Y9METO36WJ3AL63XH3TT2G-2,"Dennis tun bɛ lafiɲɛbɔ la, Nelson tora so, o la sa, salati min tun bɛ _ ka frigo kɔnɔ, o tun bɛ kɛ ka salati dilan.",Dennis,Nelson,2
3V0TR1NRVA0JH6JKUXVHJGA3DQC4A6-2,"Jen y’a ka derma roller bila ji la, walasa saniyabaga ka se k’a banakisɛw faga ni _ ye.",derma roller,ji,2
3V0TR1NRVA0JH6JKUXVHJGA3DQC4A6-1,Jen y’a ka derma roller bila ji la walasa saniyalan ka se ka _ banakisɛw faga.,derma roller,ji,1
32LAQ1JNTB327PBFZ1PGJNMXOF2TU1-2,James tun bɛ dosiye kɛ saki min na o tun ka bon. N b’a ɲininka mun na a ye _ sugandi min ka dɔgɔ.,saki,dosiye,2
32LAQ1JNTB327PBFZ1PGJNMXOF2TU1-1,James tun bɛ dosiye kɛ saki min na o tun ka bon. N b’a ɲininka mun na a ye _ sugandi min ka bon.,saki,dosiye,1
31JUPBOORN21WQXQ3RAK966J43N8L4-1,Glockenspiel fɔli dege tun ye instinctive ye Derrick fɛ nka Adam ma kɛ bawo _ ye arty ye.,Derrick,Adam,1
31JUPBOORN21WQXQ3RAK966J43N8L4-2,Glockenspiel fɔli dege tun ye instinctive ye Derrick fɛ nka Adam ma kɛ bawo _ tɛ musical ye.,Derrick,Adam,2
3VI0PC2ZA0YEB1028PE49KFFKM0XO6-2,"Ne kunbere joginni ka dɔgɔn ka tɛmɛ ne senkuru kan, o la ne b’a ɲini ne kana _ degun kojugu ni ne bɛ se k’a dɛmɛ.",kunbere,senkuru,2
3VI0PC2ZA0YEB1028PE49KFFKM0XO6-1,"Ne gɛnɛgɛnɛ joginlen don ka tɛmɛ ne senkɔni kan, o la ne b’a ɲini ne kana _ degun kojugu ni ne bɛ se k’a dɛmɛ.",kunbere,senkuru,1
3XABXM4AJ3JRHCCAFUUGIQTM9XA8QL-2,"Donald tun man di a ye ka to saniya la i n’a fɔ Matthew y’a kɛ cogo min na, o de la _ tun ka teli ka kasa duman bɔ.",Donald,Matthew,2
3XABXM4AJ3JRHCCAFUUGIQTM9XA8QL-1,"Donald tun man di a ye ka to saniya la i n’a fɔ Matthew y’a kɛ cogo min na, o de la _ kasa tun ka teli ka bɔ.",Donald,Matthew,1
3PKJ68EHDNUOUBAJ3ASD64MQ8GSHJH-1,"Cɛ y’a faamu ko a ye wɛrɛ san a ka lunɛti kama sanni ka wɛrɛ san a ka kamera kama, bawo _ wɛrɛ tun ka bon kosɛbɛ.",kamera,lunɛti,1
3PKJ68EHDNUOUBAJ3ASD64MQ8GSHJH-2,"Cɛ y’a faamu ko a ye wɛrɛ san a ka lunɛti kama sanni ka wɛrɛ san a ka kamera kama, bawo _ wɛrɛ tun ka misen kosɛbɛ.",kamera,lunɛti,2
3CZH926SIES118Z3U0937XO2MY24EM-1,"Dimansi wulada fɛ, Laura ye bisikiw dilan Victoria ye, _ ye u dilan joona.",Laura,Victoria,1
3CZH926SIES118Z3U0937XO2MY24EM-2,"Tofani malada wulada fɛ, nke Laura que bisikiw dilan Victoria ye ani _ y’u dun joona.",Laura,Victoria,2
3GKAWYFRAR7IYV7MWPQ74DHCD8SDP4-1,"Walasa k’a ka gɛlɛyaw ɲɛnabɔ, kamalennin in ye sɛbɛnni kɛ kunnafonisɛbɛn kɔnɔ, a ma sɛbɛnni kɛ kunnafonisɛbɛn kɔnɔ bawo _ sɛbɛnfuraw tun ka bon.",kunnafonisɛbɛn,kunnafonisɛbɛn,1
3GKAWYFRAR7IYV7MWPQ74DHCD8SDP4-2,"Walasa k’a ka gɛlɛyaw ɲɛnabɔ, kamalennin in ye sɛbɛnni kɛ kunnafonisɛbɛn kɔnɔ, a ma sɛbɛnni kɛ kunnafonisɛbɛn kɔnɔ bawo _ sɛbɛnfuraw tun ka dɔgɔ.",kunnafonisɛbɛn,kunnafonisɛbɛn,2
3G9UA71JVVSR1M47Q161FRXWUFWJ7L-2,Bob y’a ka fini fara min tun ye sufɛ fini ye. A y’a latigɛ ka tuxedo semisi sɔrɔ bawo _ ye kura ye.,sufɛ fini,tuxedo semisi,2
3G9UA71JVVSR1M47Q161FRXWUFWJ7L-1,Bob y’a ka fini fara min tun ye sufɛ fini ye. A y’a latigɛ ka tuxedo semisi sɔrɔ bawo _ kɔrɔlen don.,sufɛ fini,tuxedo semisi,1
37NXA7GVST4Z72T3BKLU1KQRKNOLVZ-1,Hunter tun b’a yɛrɛ faga ani Robert y’a jaabi bawo _ ma deli ka kɛ nin ko gɛlɛn in na.,Hunter,Robert,1
37NXA7GVST4Z72T3BKLU1KQRKNOLVZ-2,Hunter tun b’a yɛrɛ faga ani Robert y’a jaabi bawo _ tun bɛ nin ko jugu in na ka kɔrɔ.,Hunter,Robert,2
37VHPF5VYC18TM3KQEHL6NGWAZ08CP-2,"Rachel ye Tanya don a ka YouTube bi denma kɔnɔ, nka _ dimina kosɛbɛ bawo a ma se ka yamaruya sɔrɔ.",Rachel,Tanya,2
37VHPF5VYC18TM3KQEHL6NGWAZ08CP-1,"Rachel ye Tanya fane ka le YouTube wideyow kɔnɔ, nka _ nimisara bawo a ma se ka yamaruya sɔrɔ.",Rachel,Tanya,1
3421H3BM9CVA9UR7PWGLLLCADYY9JU-1,"Felicia, n’o ye tɛrɛn ɲɛminɛbaga ye, a bɛ san caman bɔ bi. Elena bɛna _ ka laadalata dɔ di u ma min bɛ bonya da u kan.",Felicia,Elena,1
3421H3BM9CVA9UR7PWGLLLCADYY9JU-2,"Felicia, n’o ye tɛrɛn ɲɛminɛbaga ye, a bɛ san caman bɔ bi. Elena bɛna jaabi dɔ di u ma, _ bonyalen don k’o di.",Felicia,Elena,2
34XASH8KLS0L2PDZ9IPAN346MHFMPG-1,"Polisiw tun bɛ se ka taama kasoden fɛ ka taa donda la nka u tun tɛ se ka taa ni a ye kasobon kɔnɔ, bawo doni tun dagalen tɛ_ kɔnɔ.",donda,kaso,1
34XASH8KLS0L2PDZ9IPAN346MHFMPG-2,"Polisiw tun bɛ se ka taama kasoden fɛ ka taa donda la nka u tun tɛ se ka taa ni a ye kasobon kɔnɔ, bawo doni tun dagalen don _ kɔnɔ.",donda,kaso,2
3LOJFQ4BOXD2TFBZZZ9ZGY75VD8DKC-1,"Tuma min na Brenda ye vɛrini kɛ a ka jiri pilansiw kan, bɛton min tun bɛ a jukɔrɔ, o nɔgɔra. Vɛrini ye _ lakana ani k'a cɛɲi.",jiri,bɛton,1
3LOJFQ4BOXD2TFBZZZ9ZGY75VD8DKC-2,"Tuma min na Brenda ye vɛrini kɛ a ka jiri pilansiw kan, bɛton min tun bɛ a jukɔrɔ, o nɔgɔra. Vɛrini ye _ tiɲɛn ani k'a cɛjuguya.",jiri,bɛton,2
3E22YV8GG14CQIZS1LSA8K5Y3PJPN6-1,John ma se ka kɔnɔni kɛ k’a ka jɛgɛ bila aquarium kura kɔnɔ tabali kan nka _ tun ɲɛ́namisɛn kojugu.,tabali,aquarium,1
3E22YV8GG14CQIZS1LSA8K5Y3PJPN6-2,John ma se ka kɔnɔni kɛ k’a ka jɛgɛ bila tabali kan jidagayɔrɔ kura kɔnɔ nka _ tun ka girin kojugu.,tabali,aquarium,2
33KGGVH24UFELKUUIP4T5QEY2RB1XU-1,"Te ye Ben ɲinw dimi, nka kafe ma dimi, bawo _ tun falen bɛ sukaro la.",te,kafe,1
33KGGVH24UFELKUUIP4T5QEY2RB1XU-2,"Te ye Ben ɲinw dimi, nka kafe ma dimi, bawo sukaro tun tɛ _ la.",te,kafe,2
3D0LPO3EABXOHHR5TNO600YFX6WOYN-1,A tun ka fisa a ma ka safinɛ kɛ ka jɔsi ni farikolo kolan safinɛ ye bawo _ tun bɛ nɛ ɲɛɲɛ.,farikolo kolan safinɛ,safinɛ,1
3D0LPO3EABXOHHR5TNO600YFX6WOYN-2,A tun ka fisa a ma ka safinɛ saniya sanni ka jisuma jeli kɛ bawo _ y’a to a ka kɛnɛya.,farikolo kolan safinɛ,safinɛ,2
3UEDKCTP9X416V9WSKID84LHXTQK70-1,"Katrina y’u ka jakite juru don Carrie la su nɛnɛ waati la, hali ni _ yɛrɛ tun nɛnɛna.",Katrina,Carrie,1
3UEDKCTP9X416V9WSKID84LHXTQK70-2,"Katrina y’u ka jakite juru don Carrie la nɛnɛ su fɛ, bawo _ tun nɛnɛna.",Katrina,Carrie,2
3HO4MYYR12MHB21WJQ5NGF6BB5EU6Y-1,"Adama tun ka kan ka waati boloda ka taa farikolodɔgɔtɔrɔ dɔ fɛ, nka Yusufu ma o kɛ bawo fari jugu tun bɛ _ la.",Adam,Joseph,1
3HO4MYYR12MHB21WJQ5NGF6BB5EU6Y-2,"Adama tun ka kan ka waati boloda ka taa farikolodɔgɔtɔrɔ dɔ fɛ, nka Yusufu ma o kɛ bawo _ fari tun ka ɲi.",Adam,Joseph,2
3LOJFQ4BOXD2TFBZZZ9ZGY75VBGKDN-2,Nancy bolo popcorn duni ka fisa ka tɛmɛ bonbon kan nin bɛ filimuw filɛ yɔrɔ la bawo _ ka di.,kabani,bonbon,2
3LOJFQ4BOXD2TFBZZZ9ZGY75VBGKDN-1,Kani de Nancy popcorn de be ka fisa ka tɛmɛ bonbon kan ni le filimuw filɛ yɔrɔ la bawo  kɔgɔ bɛ _ na.,Nancy,bonbon,1
36JW4WBR06I8P9ONKK1SR6UYAUBHFF-2,"O baara kɔrɔ tun ye ko Emily tun bɛ jɛ ka baara kɛ ni Victoria ye, ale min tun tɛ dusu don a kɔnɔ kosɛbɛ. _ tun bɛ baara kɛ ni mɔgɔ wɛrɛw ye, o kɔniya.",Emily,Victoria,2
36JW4WBR06I8P9ONKK1SR6UYAUBHFF-1,"O baara kɔrɔ tun ye ko Emily tun bɛ jɛ ka baara kɛ ni Victoria ye, ale min tun tɛ dusu don a kɔnɔ kosɛbɛ. A tun ka di _ ye ka baara kɛ ni mɔgɔ wɛrɛw ye.",Emily,Victoria,1
3EAWOID6MTVMA64HMRZB30Y3HPJV06-2,"K’a sɔrɔ Maria tun bɛ bisi ta ka taa baara la, Megan ye moto ta bawo _ ka permis tun ma ban.",Maria,Megan,2
3EAWOID6MTVMA64HMRZB30Y3HPJV06-1,"K’a sɔrɔ Maria tun bɛ bisi ta ka taa baara la, Megan tun bɛ moto boli bawo _ ka lakɔliso ka lakɔliso ka lakɔliso ka lakɔliso ka lakɔliso ka lakɔliso ka lakɔliso sɛbɛn waati tɛmɛna.",Maria,Megan,1
3IQ9O0AYW8DXYYGF5K020KYNW0UTI8-1,Steven tun bɛ ni tulo kelen dɔrɔn ye nka Jeffrey tun bɛ ni fila ye. O kɔrɔ ye ko _ tun tɛ balansi sɔrɔ kosɛbɛ.,Steven,Jeffrey,1
3IQ9O0AYW8DXYYGF5K020KYNW0UTI8-2,Steven le di feke kelen dɔrɔn ye nka Jeffrey tun bɛ kane bila ye ye. O kɔrɔ ye ko _ tun ye simetri ye kosɛbɛ.,Steven,Jeffrey,2
3NZ1E5QA6ZZ6WZSCEGENJJ0NQJ8B5I-2,Kevin ye Kyle ka jiriminɛnw labɛn dɔgɔkun tɛmɛnen na kabini _ tun ye minisiri dɔnbaga ye.,Kevin,Kyle,2
3NZ1E5QA6ZZ6WZSCEGENJJ0NQJ8B5I-1,Kevin ye Kyle ka jiriminɛnw labɛn dɔgɔkun tɛmɛnen na bawo _ mago tun bɛ minisiri dɔnbaga dɔ la.,Kevin,Kyle,1
3TLFH2L6Y9METO36WJ3AL63XCGGT2O-2,Eric tun b’a miiri ko finiw cɛ ka ɲi kosɛbɛ nka Kevin ma sɔn o ma. _ ma o finiw san.,Eric,Kevin,2
3TLFH2L6Y9METO36WJ3AL63XCGGT2O-1,Eric tun b’a miiri ko finiw cɛ ka ɲi kosɛbɛ nka Kevin ma sɔn o ma. _ ye finiw san.,Eric,Kevin,1
38DCH97KHH01749MM0F7FIERULOJQA-1,"Jessica ka teli ka kɔnɔboli juguman sɔrɔ, Victoria tɛ o sɔrɔ, o la _ tɛ wuli ka wuli.",Jessica,Victoria,1
38DCH97KHH01749MM0F7FIERULOJQA-2,"Jessica ka teli ka fɔɔnɔnege jugumanba sɔrɔ, Victoria tɛ o sɔrɔ, o de y’a to _ ka teli ka taa wuluwuluba dɔ kan.",Jessica,Victoria,2
375VSR8FVYN6D9SX1ZJT000V3J3RZB-2,"Jeffrey tun bɛ baara kɛ ni sistɛmu min ye, o tun ye kabako ye ni i y’a suma ni Randy ta ye bawo _ sitɛmu tun ka dɔgɔ.",Jeffrey,Randy,2
375VSR8FVYN6D9SX1ZJT000V3J3RZB-1,"Jeffrey tun bɛ baara kɛ ni sistɛmu min ye, o tun ye kabako ye ni i y’a suma ni Randy ta ye bawo _ sitɛmu tun bɛ sanfɛ.",Jeffrey,Randy,1
31JUPBOORPIGQFWXNPMK14USYAP8LZ-2,"Jerry ye waati jan ta ka a kunsigi ko kunsigi ko safunɛ ka tɛmɛ a bonbonsi kan, hali ni _ tun cayara.",kunsigi,bonbonsi,2
31JUPBOORPIGQFWXNPMK14USYAP8LZ-1,"Jerry ye waati jan ta ka a kunsigi ko kunsigi ko safunɛ ka tɛmɛ a bonbonsi kan, hali ni _ tun tigɛra ka surunya.",kunsigi,bonbonsi,1
3WRKFXQBOB5ELVG2VSB1G32TGHMIYA-2,"Yala i delila ka taama kɛ sigida la, Samantha ye Tanya ɲininka, _ ye ɲininkali dɔ jaabi.",Samantha,Tanya,2
3WRKFXQBOB5ELVG2VSB1G32TGHMIYA-1,"Yala aw delila ka taama kɛ sigida la, Samantha ye Tanya ɲininka, _ bɛ ɲininkali dɔ makɔnɔ min bɛna jaabi.",Samantha,Tanya,1
3BA7SXOG1JOCZOS38B7GVIFIFGW8RP-1,Ben tun bɛ ka sugandili kɛ fini jago ni farikoloɲɛnajɛ baara cɛ. A labanna ka _ baarada da yele bawo a tun bɛ kɛnɛya di.,farikoloɲɛnajɛ,fini jago,1
3BA7SXOG1JOCZOS38B7GVIFIFGW8RP-2,Ben tun bɛ ka sugandili kɛ fini jago ni farikoloɲɛnajɛ baara cɛ. A labanna ka _ baarada da yele bawo a tun tɛ kɛnɛya di.,farikoloɲɛnajɛ,fini jago,2
30ZKOOGW2W42P7M17FCFLI30WQ91AW-2,"Jason tun bɛ taa baara ɲininkali dɔ la, Logan y’a labɛn kɔfɛ. _ tun bɛ waso kosɛbɛ.",Jason,Logan,2
30ZKOOGW2W42P7M17FCFLI30WQ91AW-1,"Jason tun bɛ taa baara ɲininkali dɔ la, Logan y’a labɛn kɔfɛ. _ ye waleɲumandɔn jira.",Jason,Logan,1
38LRF35D5LUIEJEE0O7P9CUR1983UN-1,"Adama y’a ye ko Steven ka tulonko bulu in kɛra fɛn ye min bɛ mɔgɔ kɔnɔnafili, bawo _ tun b’a yɛrɛ ka nɛɛma dɔn.",Adam,Steven,1
38LRF35D5LUIEJEE0O7P9CUR1983UN-2,"Adama y’a ye ko Steven ka tulonko bulu in kɛra fɛn ye min bɛ mɔgɔ kɔnɔnafili, bawo _ tun t’a yɛrɛ ka nɛɛma dɔn.",Adam,Steven,2
3CMIQF80GNOPJ9UF2HLI6E9M8HA6Q1-2,Mary farikolo tun ka fisa ani a tun bɛ a yɛrɛ jira ka tɛmɛ Emily kan. _ bɛ bikini donli kɔniya kɔgɔjida la.,Mary,Emily,2
3CMIQF80GNOPJ9UF2HLI6E9M8HA6Q1-1,Kne ndeko Mary ka fisa ani a tun bɛ a yɛrɛ jira ka tɛmɛ Emily kan. _ ka di a ye ka bikini don ka taa kɔgɔjida la.,Mary,Emily,1
31S7M7DAGI4ZOZOLQNXFS0QEB4XTLR-1,Adam tun b’a bamuso William bato. _ y’a latigɛ k’a kabakoya ni taama ye Erɔpu jamanaw na.,Adam,William,1
31S7M7DAGI4ZOZOLQNXFS0QEB4XTLR-2,Adam tun b’a li de lido William bato. _ ye kabakoba sɔrɔ ni taama ye Erɔpu jamanaw na.,Adam,William,2
3G3AJKPCXLQKDOHNA39XM2SAB2JY4F-1,Eric ɲɛnajɛ tun ka nɔgɔn ka tɛmɛ Justin kan bawo _ tun bɛ nisɔndiya kosɛbɛ.,Eric,Justin,1
3G3AJKPCXLQKDOHNA39XM2SAB2JY4F-2,Touka ne Eric nɔgɔn ka ɲɛnajɛ kɛ ka tɛmɛ Justin kan bawo _ tun bɛ ni nisɔndiya jugu ye.,Eric,Justin,2
3DW3BNF1GJWJMK8R1TOQODSUPG98VG-1,"O sarali kɛra Jason fɛ Dennis ma, bawo _ tun ye juru caman ta ka tɛmɛn.",Jason,Dennis,1
3DW3BNF1GJWJMK8R1TOQODSUPG98VG-2,"O sarali kɛra Jason fɛ Dennis ma, bawo _ tun ye wari caman juru don ka tɛmɛn.",Jason,Dennis,2
3P458N04Q1FLA5CQ1T47A9O3PFV2XD-1,Victoria fari fagara Sarah kasa kosɔn ani _ tun t’a fɛ ka kɛ u lamini na.,Victoria,Sarah,1
3P458N04Q1FLA5CQ1T47A9O3PFV2XD-2,Victoria fari fagara Sarah kasa kosɔn ani _ maloyara ka kɛ u lamini na.,Victoria,Sarah,2
3D0LPO3EADD3B6QCDL06SYMOM5COYB-2,Tina y’a ɲini dunanw fɛ u k’u ka sani ye ledo fe so kɔnɔ bawo tapi kura b’a bolo. A ko _ tɛ se ka nɔgɔ.,Sanbaraw,tapi,2
3D0LPO3EADD3B6QCDL06SYMOM5COYB-1,Tina y’a ɲini dunanw fɛ u k’u hike lenido u dontɔ so kɔnɔ bawo tapi kura b’a bolo. A ko _ ka teli ka nɔgɔ.,Sanbaraw,tapi,1
3YGE63DIN8VZPV4MC147P2HHJJW0WX-1,Samantha ye se sɔrɔ dɔnko ɲɛɲini na Jennifer fɛ bawo _ tun bɛ ni dɔnkilidacogo ɲuman ye.,Samantha,Jennifer,1
3YGE63DIN8VZPV4MC147P2HHJJW0WX-2,Samantha ye se sɔrɔ dɔnko ɲɛɲini na Jennifer fɛ bawo _ tun bɛ ni dɔnkilidacogo jugu ye.,Samantha,Jennifer,2
3L60IFZKF5W7XUE0Z81SMPUJJJGHH1-2,Jessica tun ka fin ka tɛmɛ Rebecca kan bawo _ tun bɛ sokola dun a bɛ se ka kɛ don o don i n’a fɔ dumuni misɛnnin.,Jessica,Rebecca,2
3L60IFZKF5W7XUE0Z81SMPUJJJGHH1-1,Jessica tun ka bon ni Rebecca ye bawo _ tun bɛ sokola dun a bɛ se ka fɔ ko don o don i n’a fɔ dumuni misɛnnin.,Jessica,Rebecca,1
3J5XXLQDHOPXLN2LPCTUXWKI8TVV3K-2,Tanya ma se ka a senw kɔrɔta fo Jennifer bawo _ farikolo tun bɛ se ka wuli kosɛbɛ.,Tanya,Jennifer,2
3J5XXLQDHOPXLN2LPCTUXWKI8TVV3K-1,Tanya ma se ka a senw kɔrɔta fo Jennifer bawo _ farikolo tun ka gɛlɛn kosɛbɛ.,Tanya,Jennifer,1
375VSR8FVW7RJKTQH17T82CMEOIRZQ-2,Ben tun ka kan k’a ka mobili walima a ka moto boli dabila. A y’a sugandi ka _ jɔ bawo a lakananen don.,moto,mobili,2
375VSR8FVW7RJKTQH17T82CMEOIRZQ-1,"Ayiwa, i ka mobili walima moto boli dabila.   A y’a sugandi ka _ dabila bawo farati tun b’a la.",moto,mobili,1
3R0WOCG21M7GWBGBTDD1MLG3SN5DU5-2,Randy ka fisa ni denmisɛnw ye ka tɛmɛ Kenneth kan bawo _ ye mɔgɔ ye min ka jugu kosɛbɛ.,Randy,Kenneth,2
3R0WOCG21M7GWBGBTDD1MLG3SN5DU5-1,Randy ka fisa ni Kenneth ye k’a kɛ i n’a fɔ denmisɛnw bɛ yen bawo _ ye mɔgɔ ye min bɛ fɛnw da ka tɛmɛ.,Randy,Kenneth,1
3CZH926SIES118Z3U0937XO2MSRE49-1,"James mago tun bɛ kɛsu belebeleba dɔ la walasa k’a ka warijɛ min falen sanu na, o mara, bawo _ ka bon.",warijɛ,sanu,1
3CZH926SIES118Z3U0937XO2MSRE49-2,"James mago tun bɛ kɛsu belebeleba dɔ la walasa k’a ka warijɛ min falen sanu na, o mara, bawo _ ka dɔgɔ.",warijɛ,sanu,2
39RRBHZ0AWFY6G9EAJO31XPYOWJZVT-2,Kɔnɔw tun ka ca nakɔ kɔnɔ ka tɛmɛ parki kan bawo bin dɔrɔn de tun bɛ _ fɛ.,nakɔ,parki,2
39RRBHZ0AWFY6G9EAJO31XPYOWJZVT-1,Kɔnɔw tun ka ca nakɔ kɔnɔ ka tɛmɛ parki kan bawo jiriden kuraw tun bɛ _ kɔnɔ.,nakɔ,parki,1
3ZVPAMTJWPH6MSXSB7V4FTKORCZGR0-1,Kayla y’a latigɛ ka kuma a denmuso Sarah fɛ cɛya ni musoya ko la bawo _ y’a ye ko a ye a ka kalolabɔ fɔlɔ sɔrɔ sisan dɔrɔn.,Kayla,Sarah,1
3ZVPAMTJWPH6MSXSB7V4FTKORCZGR0-2,Kayla y’a latigɛ ka kuma a denmuso Sarah fɛ cɛya ni musoya ko la bawo _ tun b’a fɔ ko a ye a ka kalolabɔ fɔlɔ kɛ sisan.,Kayla,Sarah,2
3D7VY91L65V446DI6FV90LB9HXIBMZ-2,"Pam ka basa y’a ku balan da la ka boli ka ta dilan jukɔrɔ sigilan nɔ na, ​​bawo _ tun bɛ a la siran ka tɛmɛ.",dilan,sigilan,2
3D7VY91L65V446DI6FV90LB9HXIBMZ-1,"Pam ka basa y’a ku balan da la ka boli ka ta dilan jukɔrɔ sigilan nɔ na, ​​bawo _ lakananen don.",dilan,sigilan,1
3PUOXASB59H099WB7IJ79F00WSRZ9D-2,"Jeffrey y’a ɲini Joel fɛ a ka kuma a dusua kan cogo la min bɛ nafa caman lase, nka tiɲɛ yɛrɛ la, _ de tun ye hakilitigi ye.",Jeffrey,Joel,2
3PUOXASB59H099WB7IJ79F00WSRZ9D-1,"Jeffrey y’a ɲini Joel fɛ a k’a dusukunnataw fɔ cogo la min bɛ nafa caman lase, nka tiɲɛ yɛrɛ la, _ de tun ye fɛn fitinin ye.",Jeffrey,Joel,1
3A3KKYU7P3FWS9BT16R5NZOUMH7MWU-2,"Jennifer tun ka fisa ni Laura ye farikoloɲɛnajɛ la, hali ni _ tun ka fisa ni farikoloɲɛnajɛ ye kosɛbɛ.",Jennifer,Laura,2
3A3KKYU7P3FWS9BT16R5NZOUMH7MWU-1,Jennifer tun ka fisa ni Laura ye farikoloɲɛnajɛ la bawo _ tun ka fisa ni farikoloɲɛnajɛ ye kosɛbɛ.,Jennifer,Laura,1
3AQN9REUTFEXDK0G3EAQP6MGTS8DYY-1,Ntolatan balɔn in tun bɛ pan sanfɛ ka tɛmɛ basikɛti balɔn kan. _ tun ka fɛgɛn ka tɛmɛ a kan.,ntolatan balɔn,basikɛti balɔn,1
3AQN9REUTFEXDK0G3EAQP6MGTS8DYY-2,Ntolatan balɔn in tun bɛ pan sanfɛ ka tɛmɛ basikɛti balɔn kan. _ tun ka girin ka tɛmɛ a kan.,ntolatan balɔn,basikɛti balɔn,2
3AXFSPQOYQW4GFJD8K4D3JADNLLJFQ-2,"Pop dɔnkiliw tun ka di Dennis ye, nka klasiki dɔnkiliw tun ka di Jason ye. _ tun bɛ dɔnkiliw kanu ni fɔlifɛnw ye minnu bɛ fɔ ni juru ye.",Dennis,Jason,2
3AXFSPQOYQW4GFJD8K4D3JADNLLJFQ-1,"Pop dɔnkiliw tun ka di Dennis ye, nka klasiki dɔnkiliw tun ka di Jason ye. _ tun bɛ dɔnkiliw kanu i bɛ se ka dɔn kɛ minnu na.",Dennis,Jason,1
3OREP8RUT294CWHWVCXENGRCLDYGBS-1,N ye forontomafɛnw fara n ka tobili kan i n’a fɔ kɔgɔ ni foronto. _ bɛ dumuni timiya.,kɔgɔ,foronto,1
3OREP8RUT294CWHWVCXENGRCLDYGBS-2,N ye forontomafɛnw fara n ka tobili kan i n’a fɔ kɔgɔ ni foronto. _ bɛ dumuni fariya.,kɔgɔ,foronto,2
3R5LWXWHR06BPZKX08PWCDI4Z2QGX8-2,"Jagokɛyɔrɔ la, Laura ye Betty ka masiri kɛ walasa a ɲɛda ka ɲɛ bawo _ tun ma man di kosɛbɛ.",Laura,Betty,2
3R5LWXWHR06BPZKX08PWCDI4Z2QGX8-1,"Jagokɛyɔrɔ la, Laura ye Betty ka masiri kɛ walasa a ɲɛda ka ɲɛ bawo _ tun ye dɔnnikɛla ye.",Laura,Betty,1
3RWB1RTQDL16H0BVFHFRIL3C3ZC8PD-1,Jason sen tun bɛ dimi ka tɛmɛ a bolo kan bawo a tun ye a _ kalaya sani a ka farikoloɲɛnajɛ kɛ.,bolo,sen,1
3RWB1RTQDL16H0BVFHFRIL3C3ZC8PD-2,"Jason sen tun bɛ dimi ka tɛmɛ a bolo kan, hali ni a tun ye a _ kalaya sani a ka farikoloɲɛnajɛ kɛ.",bolo,sen,2
3R6RZGK0XHQY1QZ9EXMKNQGVH4HYV4-2,Randy ye mɔni dege Derrick fɛ bawo _ tun ye baarakɛla ye min ka baara kɛra san caman kɔnɔ.,Randy,Derrick,2
3R6RZGK0XHQY1QZ9EXMKNQGVH4HYV4-1,"Randy ye mɔni dege Derrick fɛ, bawo _ tun ye daminɛbaga dɔrɔn de ye ni tile de dɔrɔn de ye.",Randy,Derrick,1
3QD8LUVX4XWD92VDJC658GRFE7NX5F-1,"K’a sɔrɔ Kayla gua de Maria ta mobili la ka taa a ka balikukalan tile fɔlɔ la, polisikɛla dɔ ye tikiti di _ ma.",Kayla,Maria,1
3QD8LUVX4XWD92VDJC658GRFE7NX5F-2,"Tuma min na Kayla tun bɛ ka Maria ta ka taa a ka denmisɛnninw ka lakɔli ta tile fɔlɔ la, polisikɛ ye bonbon kalamani di _ ma.",Kayla,Maria,2
3OQQD2WO8KKSZHILQ5UBI7UO0L23IM-2,"Esɛki tulon ka jugu farikolo ma nka a ka bon hakili ma, bawo miiri nafa ka bon _ yiriwali la.",farikolo,hakili,2
3OQQD2WO8KKSZHILQ5UBI7UO0L23IM-1,"Esɛki tulon ka jugu farikolo ma nka a ka bon hakili ma, bawo miiri nafa tɛ _ yiriwali la.",farikolo,hakili,1
3PKVGQTFIHIREUJLLF5AUV3K8W3YRZ-2,"Amy tun b’a fɛ ka ɲinmugu nɔgɔlen dɔ sɔrɔ, nka Mary tun b’a fɛ ka ɲinmugu gɛlɛn dɔ sɔrɔ bawo _ tun bɛ hami tartar ko la.",Amy,Mary,2
3PKVGQTFIHIREUJLLF5AUV3K8W3YRZ-1,"Amy tun b’a fɛ ka ɲinw burusi nɔgɔlen sɔrɔ, nka Mary tun b’a fɛ ka min jɔlen sɔrɔ bawo _ tun bɛ siran dimi ɲɛ.",Amy,Mary,1
3IV1AEQ4DTRAVP8XK4A7LPH0UT2J86-2,Jeffrey ye so dɔ jɔ Kenneth ye walisa _ ka sigiyɔrɔ kura ɲuman sɔrɔ.,Jeffrey,Kenneth,2
3IV1AEQ4DTRAVP8XK4A7LPH0UT2J86-1,Jeffrey ye so dɔ jɔ ni Kenneth ka dɛmɛ ye walasa _ bɛ sigiyɔrɔ kura ɲuman sɔrɔ.,Jeffrey,Kenneth,1
3HRWUH63QU08X8H9H6JWAE0H7AE5NX-1,"Megan ye den sɔrɔ k’a sɔrɔ Katrina nde ki sɔrɔ min si bɛ koleji la, o la _ tun ka kan ka diapers Changer hali bi.",Megan,Katrina,1
3HRWUH63QU08X8H9H6JWAE0H7AE5NX-2,"Megan ye den sɔrɔ k'a sɔrɔ Katrina ye den sɔrɔ min si bɛ koleji la, o la _ mago tun tɛ ka diapers Changer tugun.",Megan,Katrina,2
3XD2A6FGFP838XAXCQPZDM3X9DR9SI-2,Megan ye flew sɔrɔ Carrie fɛ bawo _ tun b’a fɛ k’u ɲininka u ka bɔ date dɔ la.,Megan,Carrie,2
3XD2A6FGFP838XAXCQPZDM3X9DR9SI-1,Megan ye flew di Carrie ma bawo _ tun b’a fɛ k’a ɲini u fɛ u ka taa date dɔ la.,Megan,Carrie,1
35U0MRQMUJ57DNW0OC1MT1ULA7DOVS-2,Nɔgɔbɔlan lankolonya tun ye baara ye min tun bɛ siran Adam ɲɛ k’a sɔrɔ Lawrence tun t’a janto o la. _  ma deli k'a ɲini ka mɔgɔ wɛrɛ deli a k'a janto a la.,Adam,Lawrence,2
35U0MRQMUJ57DNW0OC1MT1ULA7DOVS-1,Nɔgɔbɔlan lankolonya tun ye baara ye min tun bɛ siran Adam ɲɛ k’a sɔrɔ Lawrence tun t’a janto o la. _ tun b'a ɲini tuma bɛɛ ka mɔgɔ wɛrɛ deli a k'a janto a la.,Adam,Lawrence,1
3DGDV62G7O7G1WAZF2UQGW20NHGP28-2,Matiyu ye dɔgɔkun laban kɛ denmisɛnnin dɔ ladonni na k’a sɔrɔ Benjamin tun bɛ lafiɲɛbɔ la ani _ a y’a janto u ka lafiɲɛbɔ la.,Matthew,Benjamin,2
3DGDV62G7O7G1WAZF2UQGW20NHGP28-1,Matiyu ye dɔgɔkun laban kɛ den dɔ ladonni na k’a sɔrɔ Benjamin tun bɛ lafiɲɛbɔ la ani _ a y’a janto den la ka balo.,Matthew,Benjamin,1
