qID,Sentence,Option1,Option2,Answer
3SNR5F7R947V9FYIFPB71YYMSK9EIS-1,"James tun bɛ ka poyi sɛbɛn a ka sɛbɛnnikɛlan kan tuma min na, lankiri banna. _ ka jan.",poyi,lankiri,1
3SNR5F7R947V9FYIFPB71YYMSK9EIS-2,"James tun bɛ ka poyi sɛbɛn a ka sɛbɛnnikɛlan kan tuma min na, lankiri banna. _ ka dɔgɔ.",poyi,	lankiri,2
34F34TZU7WXKFL71KPP6J0GOJZ2J2X-2,Furuɲɔgɔnma fila tun bɛ diwɛn min jiminwɛrɛ kɔnɔ sanni ka diwɛn min tasa la bawo _ u tun saniyalen don.,tasa,	jiminwɛrɛ,2
34F34TZU7WXKFL71KPP6J0GOJZ2J2X-1,Furuɲɔgɔnma fila tun bɛ diwɛn min jiminwɛrɛ kɔnɔ sanni ka diwɛn min tasa la bawo _ tun nɔgɔlen don.,	tasa,	jiminwɛrɛ,1
37PGLWGSJVKYVFQSBBMAZTBQBYPKIX-1,Bonbon tilali tun ka gɛlɛn ka tɛmɛ pɔmi tilali kan bawo denmisɛn kelen-kelen bɛɛ tun bɛ _ fɛ.,Bonbon,pɔmi,1
37PGLWGSJVKYVFQSBBMAZTBQBYPKIX-2,bonbon tilali tun ka gɛlɛn ka tɛmɛ pɔmi tilali kan bawo denmisɛn si tun tɛ _ fɛ.,Bonbon,pɔmi,2
3O4VWC1GEW49033KOP3B2ALGKZ73J0-1,Brian tun b’a fɛ ka kɛ so marabaga dɛmɛbaga ye Kenneth tun t’o kɛ bawo so kɔnɔ to li tun ka di _  ye.,Brian,Kenneth,1
3O4VWC1GEW49033KOP3B2ALGKZ73J0-2,Brian tun b’a fɛ ka kɛ so marabaga dɛmɛbaga ye Kenneth tun t’o kɛ bawo so kɔnɔ to li tun man di _  ye.,Brian,Kenneth,2
3B6F54KMR2A6P38VOFY66IX6ND11SG-2,"Brian tun bɛ warimisɛn camanba mara minnu tun ka di Kevin ye kosɛbɛ, o de la _ ye dɔw ɲini a fɛ.",Brian,Kevin,2
3B6F54KMR2A6P38VOFY66IX6ND11SG-1,"Brian tun bɛ warimisɛn camanba mara minnu tun ka di Kevin ye kosɛbɛ, o de la _ ye dɔw di a ma.",Brian,Kevin,1
3APP19WN73SD09Z8JJS64YTSV1P6GK-2,"William Kinile ndeila fi bɛɛ kɔ Ian ye kɛlen k'u kisi, hali ni _ da rini di kosɛbɛ dela niado.",William,lan,2
3APP19WN73SD09Z8JJS64YTSV1P6GK-1,"William ɲinɛna waati bɛɛ kɔ Ian ye kɛlen k'u kisi, barsa _ tun bɛ a sen don a la kosɛbɛ.",William,Ian,1
3CMIQF80GP44DYTMMFXIYCXU1CV6QO-2,"Katrina bɛ kalan Korekan na Felicia fɛ, o la sa, n’a sɔrɔla _ wolola Kore jamana na.",Katrina,Felicia,2
3CMIQF80GP44DYTMMFXIYCXU1CV6QO-1,"Katrina bɛ kalan Korekan na Felicia fɛ, o la sa, n’a sɔrɔla _ wolola Ameriki.",Katrina,Felicia,1
3HEA4ZVWVF0J18AAX4ZA8VO39BB55O-2,Jason banna Ian ka pasipɔri ɲinini na bawo _ ma se ka sɛbɛn bɛnnenw di a waati la.,Jason,Ian,2
3HEA4ZVWVF0J18AAX4ZA8VO39BB55O-1,Jason gue line ka pasipɔri ɲinini na bawo _ ma sɛbɛn ɲumanw sɔrɔ a waati la.,Jason,lan,1
32L724R85LIKCHO145FI3C9HHSMIPK-2,"N tun b’a fɛ ka vanili esansi ni te jiri kasaw fara ɲɔgɔn kan, nka a kasa tun bɛ i n’a fɔ vanili bawo _ esansi tun barika ka dɔgɔ kojugu.",vanili,te jiri,2
32L724R85LIKCHO145FI3C9HHSMIPK-1,"N tun b’a fɛ ka vanili esansi ni te jiri kasaw fara ɲɔgɔn kan, nka a kasa tun bɛ i n’a fɔ vanili bawo _ esansi barika tun ka bon kojugu.",vanili,te jiri,1
3LN50BUKPXP1W7VE96OVNQPINZBPLG-2,N b’a fɛ ka tulon kɛ ntolatantɔn dɔ la nin ka kɛ ntolatana ye ntolatantɔn dɔ la bawo _ balɔn tan ka gɛlɛn.,ntolatan,balɔntan,2
3LN50BUKPXP1W7VE96OVNQPINZBPLG-1,N b’a fɛ ka tulon kɛ ntolatantɔn dɔ la ka tɛmɛn ka kɛ ntolatantɔn dɔ ka nɛgɛsotigi ye bawo _ balɔn tan ka nɔgɔn.,ntolatan,balɔntan,1
3I4E7AFQ2KXEZK1E3492KNPEER2TJB-1,"Kyle tun b’a miiri ko goniyahakɛ tun ka goni kojugu k’a sɔrɔ William tun b’a miiri ko nɛnɛ ka bon kojugu, o de la _ ye funteni dɔgɔya.",Kyle,William,1
3I4E7AFQ2KXEZK1E3492KNPEER2TJB-2,"Kyle tun b’a miiri ko goniyahakɛ tun ka goni kojugu k’a sɔrɔ William tun b’a miiri ko nɛnɛ ka bon kojugu, o de la _ ye funteni wuli.",Kyle,William,2
3PIOQ99R7YKPIN7OI7R4IQSX6RPUNM-2,"William ine soro le sɛfan dɔ sɔrɔ sɔgɔmada dumuni na, nka Kevin ye laban dun, o de la _ tun ka kan ka sɛnɛfɛnw di u ma.",William,Kevin,2
3PIOQ99R7YKPIN7OI7R4IQSX6RPUNM-1,"William ine soro felo fɛ ka sɛfan dɔ sɔrɔ sɔgɔmada dumuni na, nka Kevin ye laban dun, o de la _ tun ka kan ka sɛnɛfɛnw dun.",William,Kevin,1
3LN3BXKGC29BUOEEA15A2SS5J15WGU-2,Muso ye saniyalan fiyɛ filɛlikɛlan kan nka a ye tabali to ye bawo _ saniyalen don.,filɛlikɛlan,tabali,2
3LN3BXKGC29BUOEEA15A2SS5J15WGU-1,Muso ye saniyalan fiyɛ filɛlikɛlan kan nka a ye tabali to ye bawo _ nɔgɔlen don.,filɛlikɛlan,tabali,1
3JY0Q5X05LKFX2OEVW1SGP6IQKYGGF-2,Justin tun bɛ dakun dɔ sɛbɛn a ka labɛn sɛbɛn kɔnɔ don o don a tɛ i n’a fɔ Matthew bawo _ tun ma labɛn.,Justin,Matthew,2
3JY0Q5X05LKFX2OEVW1SGP6IQKYGGF-1,Justin tun bɛ dakun dɔ sɛbɛn a ka labɛn sɛbɛn kɔnɔ don o don a tɛ i n’a fɔ Matthew bawo _ tun labɛnna.,Justin,Matthew,1
3UOMW19E6D4P64KISGAIU365DNSC5H-2,"Denmisɛnw tun bɛ se ka bulw hakɛ jate dɔrɔn daga kelen kɔnɔ, siyɔ tun tɛ se ka jate tɔ kelen kɔnɔ bawo _ tun ka ca kojugu.",bulw,siyɔ,2
3UOMW19E6D4P64KISGAIU365DNSC5H-1,"Denmisɛnw tun bɛ se ka bulw hakɛ jate dɔrɔn daga kelen kɔnɔ, siyɔ tun tɛ se ka jate tɔ kelen kɔnɔ bawo _ tun ka nɔgɔn.",bulw,siyɔ,1
33W1NHWFYHJ4ZZ6ILQCO8HD4XV4TZX-1,Erin dɔnen do iko baarakɛla k’a sɔrɔ Victoria ye baarakɛden dɔrɔn de ye bawo baarada bɛ _ bolo.,Erin,Victoria,1
33W1NHWFYHJ4ZZ6ILQCO8HD4XV4TZX-2,Erin dɔnen do iko baarakɛla k’a sɔrɔ Victoria ye baarakɛden dɔrɔn de ye bawo baarada tɛ _ bolo.,Erin,Victoria,2
30Y6N4AHYPUOGJOUPJIWHATJQ9LDRW-2,"Komin _ sera baara la kɔfɛ, Dennis ye tilelafana dun ka kɔn Adam ɲɛ lafiɲɛbɔyɔrɔ la u ka baarakɛyɔrɔ la.",Dennis,Adam,2
30Y6N4AHYPUOGJOUPJIWHATJQ9LDRW-1,"Ikomi _ tun sera baarakɛyɔrɔ la joona, Dennis ye tilelafana dun ka kɔn Adam ɲɛ lafiɲɛbɔyɔrɔ la u ka baarakɛyɔrɔ la.",Dennis,Adam,1
3ZFRE2BDQ9CBGGF2Q0DLXKYAANVZXH-1,"Neil kɔnɔbara tun bɛ ka kulukulu, nka a tun bɛ iko Samuɛl tun bɛ a cogo la, bawo kɔngɔ tun bɛ _ la.",Neil,Samuel,1
3ZFRE2BDQ9CBGGF2Q0DLXKYAANVZXH-2,"Neil kɔnɔbara tun bɛ ka kulukulu, nka a tun bɛ iko Samuɛl tun bɛ a cogo la, bawo _ tun falen don.",Neil,Samuel,2
3MDWE879UJG4RBTV1434NXTX5R0B9I-2,Logan ye ɲɔnibana sɔrɔ Joseph fɛ okofe _ ye tile bɛɛ kɛ ka sɛbɛn dumanw ci o ko la.,Logan,Joseph,2
3MDWE879UJG4RBTV1434NXTX5R0B9I-1,Logan ye ɲɔnibana sɔrɔ Joseph fɛ okofe _ ye tile bɛɛ kɛ ka sɛbɛn juguw ci o ko la.,Logan,Joseph,1
31ANT7FQN80GNCVYE8OJ5U3LQEB5HV-1,Cɛ tun b'a fɛ ka bagaji bila so kɔnɔ nka _ tun ka dɔgɔ kojugu.,so,bagaji,1
31ANT7FQN80GNCVYE8OJ5U3LQEB5HV-2,Cɛ tun b'a fɛ ka bagaji bila so kɔnɔ nka _ tun ka bon kojugu.,so,bagaji,2
3MDWE879UJG4RBTV1434NXTX5T39BN-2,Betty tun tɛ se ka ɲinɛ o ko kɛlen kɔ fewu nka Samantha tun bɛ se ka ɲinɛ bawo _ tun bɛ siran o ɲɛ kabini kalo caman.,Betty,Samantha,2
3MDWE879UJG4RBTV1434NXTX5T39BN-1,Betty tun tɛ se ka ɲinɛ o ko kɛlen kɔ fewu nka Samantha tun bɛ se ka ɲinɛ bawo _ tun sigilendo n'o yekabini kalo caman.,Betty,Samantha,1
3YGYP13643NCWKEEYB8Z5DTLS2KNR6-1,Kyle ye telefɔni kura san k’a jira Leslie la bawo _ nisɔndiyara telefɔni kura ko la.,Kyle,Leslie,1
3YGYP13643NCWKEEYB8Z5DTLS2KNR6-2,Kyle ye telefɔni kura san k’a jira Leslie la nka _ nisɔngoyara telefɔni kura ko la.,Kyle,Leslie,2
3YLPJ8OXXARA78QKP5ZVVM9A3A94X6-1,"Fane kadi inle  delo minɛ, aw bɛ se ka aw ko ni ji kalanman ye walima ka fini kalanman da la, nka _ kɛli ka gɛlɛn.",delo,fini kalanman,1
3YLPJ8OXXARA78QKP5ZVVM9A3A94X6-2,Gani lane nfefa koni dila ine ke delo nefi ake thie dani fanle  _ kɛli ka fusa.,delo,fin kalanman,2
3ZQX1VYFTD392B0NGJQC1NAD4V4O8S-1,"Neil sɔnna ka dɛmɛ don Adam ka wuluba koli la, wa _ tun kɔrɔtɔlen don kosɛbɛ o dɛmɛ la.",Neil,Adam,1
3ZQX1VYFTD392B0NGJQC1NAD4V4O8S-2,"Neil sɔnna ka dɛmɛ don Adam ka wuluba koli la, wa _ ye waleɲumandɔnba jira a ka dɛmɛ na.",Neil,Adam,2
3L60IFZKF5W7XUE0Z81SMPUKLT4HHD-2,"Cricket ye Lindsey ka ɲɛnajɛ ye min ka di a ye kosɛbɛ, hali ni Rachel ma deli k’o mɛn. _ ka teli ka kɛ Ameriki ye.",Lindsey,Rachel,2
3L60IFZKF5W7XUE0Z81SMPUKLT4HHD-1,"Cricket ye Lindsey ka ɲɛnajɛ ye min ka di a ye kosɛbɛ, hali ni Rachel ma deli k’o mɛn. _ ka teli ka kɛ tubabukan ye.",Lindsey,Rachel,1
3K8CQCU3KGFH4GV0X5I5SC12KHZNW9-1,"A jɛlen don ko Jessica ye Monika ka barokun faamu, wa a ɲɛnajɛra bawo _ de tun ye kalanden ye.",Jessica,Monica,1
3K8CQCU3KGFH4GV0X5I5SC12KHZNW9-2,"A jɛlen don ko Jessica ye Monica ka barokun faamu, wa a ɲɛnajɛra bawo _ de tun ye a sɛbɛnbaga ye.",Jessica,Monica,2
3W3RSPVVGU5EOC3AQSNPXWCGUI3ULI-2,"A kɛlen k’a ɲini wuluw ka sɔgɔsɔgɔninjɛ kunbɛn, Emily ye Maria bila ka taa fura ta, nka _ bolo degunnen don baganw sɛgɛsɛgɛli la.",Emily,Maria,2
3W3RSPVVGU5EOC3AQSNPXWCGUI3ULI-1,"A kɛlen k’a ɲini ka wuluw ka sɔgɔsɔgɔ kunbɛn, Emily ye Maria bila ka taa fura in ta bawo _ bolo degunnen don baganw sɛgɛsɛgɛli la.",Emily,Maria,1
3BC9H1KCYUAWMQ07K9FGHUB108VWY7-1,Jan ye limoniji bɔli bɛɛ bɔn namasa tasa kɔnɔ fo ka _ lankolonya.,bɔli,tasa,1
3BC9H1KCYUAWMQ07K9FGHUB108VWY7-2,Jan ye limoniji bɔli bɛɛ bɔn namasa tasa kɔnɔ fo ka _ fa.,bɔli,tasa,2
3MQKOF1EE2MTOF5GODS24910D6FWDS-2,Asiransi ye Leslie jalaki Logan nɔ na kasaara in na kabini _ tɛmen na ka sirabakan lanpan yelen to binkɛnɛman la.,Leslie,Logan,2
3MQKOF1EE2MTOF5GODS24910D6FWDS-1,Asiransi ye Leslie jalaki Logan nɔ na kasaara in na kabini _ tɛmen na ka sirabakan lanpan yelen to bilenman la.,Leslie,Logan,1
3N5YJ55YXG153ETQC2ADIPG345GANC-1,Tobilikɛla y’a fene le inka di in mara minɛn kɔnɔ nka _ tun ka bon kojugu.,fene,minɛn,1
3N5YJ55YXG153ETQC2ADIPG345GANC-2,Tobilikɛla y’a latigɛ ka dumuni fele kone minɛn kɔnɔ nka _ tun ka dɔgɔ kojugu.,fene,minɛn,2
3TFJJUELSHNX771VAX8KWW3TTFCC2V-1,"A diyara n balimamuso ye ka sɛbɛnni kɛ bulɔgu kan ka tɛmɛ a ka gafesɛbɛn kan, bawo _ tun bɛ se ka sɔrɔ bɛɛ fɛ.",bulɔgu,zúrunali,1
3TFJJUELSHNX771VAX8KWW3TTFCC2V-2,"Sɛbɛnni tun ka di n balimamuso ye bulɔgu kan ka tɛmɛ a ka donkibaru kan, bawo _ tun tɛ ye mɔgɔ si fɛ.",bulɔgu,zúrunali,2
3ODOP6T3AUY96SNN1GE25WFER5142X-1,"Derrick ye samiyɛ bɛɛ kɛ ka da kɔgɔjida la min ka timi, ka sɔrɔ Jeffrey ye samiyɛ kɛ so kɔnɔ, o la sa, _ kunsigi ye tile tiɲɛni caman sɔrɔ.",Derrick,Jeffrey,1
3ODOP6T3AUY96SNN1GE25WFER5142X-2,"Derrick ye samiyɛ bɛɛ kɛ ka da kɔgɔjida la min ka timi, Jeffrey ye samiyɛ kɛ so kɔnɔ, o la sa, _ kunsigi ma tiɲɛ kosɛbɛ tile fɛ.",Derrick,Jeffrey,2
3NQUW096N8MG4KF7SHSY10P3IVT9L5-1,Nin menu in tun ye eclectic ye kosɛbɛ. U ye fɛn bɛɛ dilan k’a ta burger saba la ka taa a bila sushi la ka taa a bila sɛfan yiranen la. _ tun bɛ ji bɔ.,burger,sushi,1
3NQUW096N8MG4KF7SHSY10P3IVT9L5-2,Nin menu in tun ye eclectic ye kosɛbɛ. U ye fɛn bɛɛ dilan k’a ta burger saba la ka taa a bila sushi la ka taa a bila sɛfan yiranen la. _ tun ye kɛnɛ ye.,burger,sushi,2
3VGET1QSZ0XD7646X0PG4HR4W9E7W9-2,"jateminɛw y' a jira ko muso caman bɛ bange don o don ni i y' a suma ni cɛw ye , _ w ka dɔgɔ.",musow,cɛw,2
3VGET1QSZ0XD7646X0PG4HR4W9E7W9-1,"jateminɛw y' a jira ko muso caman bɛ bange don o don ni i y' a suma ni cɛw ye , _ w ka ca .",musow,cɛw,1
3TCFMTM8HG2SETQ4EYV07Y8BFL721Y-2,"Robert ye sugandili kɛ ka Neil ka so san, o la sa, _ ye wari caman wɛrɛ sɔrɔ o kɔfɛ banki la.",Robert,Neil,2
3TCFMTM8HG2SETQ4EYV07Y8BFL721Y-1,"Robert ye sugandili kɛ ka Neil ka so san, o la sa, wari caman tun bɛ _ bolo banki la o kɔfɛ.",Robert,Neil,1
3RWB1RTQDL16H0BVFHFRIL3C3XW8PT-2,"Dɔgɔtɔrɔso sɛgɛsɛgɛli min kɛra bolo karilen na, o ye waati jan ta ka tɛmɛ dusukun sɛgɛsɛgɛli kan barisa _ tun ye gɛlɛyaba ye.",dusukun,bolo,2
3RWB1RTQDL16H0BVFHFRIL3C3XW8PT-1,"Sele fekine nde sɛgɛsɛgɛli min kɛra bolo karilen na, o tun ka surun ka tɛmɛ dusukun sɛgɛsɛgɛli kan barisa _ tun ye gɛlɛyaba ye.",dusukun,bolo,1
3ACRLU860NC6SIL5PH7QND603EIEB1-2,"Tuma min na a tun bɛ kuma u ka cɛnimusoya kan, Kenneth ye sɔgɔsɔgɔ kɛ Jeffrey la bawo _ ɲinɛna u ka fɛnɲɛnɛmaw kɔ.",Kenneth,Jeffrey,2
3ACRLU860NC6SIL5PH7QND603EIEB1-1,"Tuma min na a tun bɛ kuma u ka cɛnimusoya kan, Kenneth ye Jeffrey tulo geren _ fɛ k’a hakili to u ka cɛnimusoya kɛbagaw ye jɔn ye.",Kenneth,Jeffrey,1
3R6RZGK0XHQY1QZ9EXMKNQGWI2FVYY-1,"Jate tun ka di Jack ye, wa a tun man di a ye ka sosiyolozi kalan kɛ, o de la a y’a latigɛ ka sosiyolozi walima jatebɔ kɛ o kalanso kɔnɔ tuma min na, ladilikɛla donna _ kɔnɔ bawo Jack tun bɛ sɔn o ma.",jate,sosiyolozi,1
3R6RZGK0XHQY1QZ9EXMKNQGWI2FVYY-2,"Jate tun ka di Jack ye ani sosiyali dɔnniya tun man di a ye. O la sa, tuma min na a y’a latigɛ ka sosiyolozi walima jatebɔ kɛ o kalo kɔnɔ, ladilikɛla ye _ w bɔ yen bawo Jack tun t’a fɛ k’o kɛ.",jate,sosiyolozi,2
3WUVMVA7OB1ZK379FQL7DCNC925ZAW-1,Christopher tun b’a fɛ ka kɛ dɔnnikɛla ye nka a tun t’a fɛ ka kɛ Adama ye bawo _ tun b’a fɛ ka barokun damadɔw de diyabɔ.,Christopher,Adam,1
3WUVMVA7OB1ZK379FQL7DCNC925ZAW-2,Christopher tun b’a fɛ ka kɛ dɔnnikɛla ye nka a tun t’a fɛ ka kɛ Adama ye bawo _ tun b’a fɛ ka ko caman kɛ.,Christopher,Adam,2
3S37Y8CWIAEVI8LUF039T3V2T04W4N-2,"Samiya tun ka di Megan ye, k’a sɔrɔ Felicia tun t’o kɛ. _ ye waati caman kɛ so kɔnɔ.",Megan,Felicia,2
3S37Y8CWIAEVI8LUF039T3V2T04W4N-1,"Samiya tun ka di Megan ye, k’a sɔrɔ Felicia tun t’o kɛ. _ ye waati caman kɛ kɔgɔjida la.",Megan,Felicia,1
3OEWW2KGQLP0DVVLHPDSFDCN5IJDO8-2,John tun tɛ se ka papier peint min nɔrɔlen bɛ kogo la ni kɔli ye bɔ kasɔrɔ papiye peint ma fara. _ barika ka dɔgɔ.,kɔli,papiye peint,2
3OEWW2KGQLP0DVVLHPDSFDCN5IJDO8-1,John tun tɛ se ka papier peint min nɔrɔlen bɛ kogo la ni kɔli ye bɔ kasɔrɔ papiye peint ma fara. _ barika ka bon.,kɔli,papiye peint,1
3VJ4PFXFJ35IY4DZ93MZWK8XC3SAUR-2,Ladilikɛla ye den tɔɔrɔlen furakɛ ani ka pupedeni di a ma sanni ka birifini di a ma bawo _ tun bɛ a taabataaba.,pupedeni,birifini,2
3VJ4PFXFJ35IY4DZ93MZWK8XC3SAUR-1,Tele nde line ma furakɛ ani ka pupedeni di a ma sanni ka birifini di a ma bawo_  tun bɛ a keli ne.,pupedeni,birifini,1
38Z7YZ2SB5GK6IONOG67VFN0CNPIQ1-2,"John ye daga ladon k’a sɔrɔ a tun bɛ taa ni a ye kɛsu kɔnɔ, nka a labanna ka kari. _ ka gɛlɛn.",daga,kɛsu,2
38Z7YZ2SB5GK6IONOG67VFN0CNPIQ1-1,"John ye daga ladon k’a sɔrɔ a tun bɛ taa ni a ye kɛsu kɔnɔ, nka a labanna ka kari. _ ye fɛn ye min bɛ se ka tiɲɛ.",daga,kɛsu,1
3R5OYNIC2C7ALV4CYHEMHJBQSDLPTZ-1,Donald y’a ka manje gomu bere laban di Leslie ma tuma min na _ tun ye manje ninakili sɔrɔ kaban.,Donald,Leslie,1
3R5OYNIC2C7ALV4CYHEMHJBQSDLPTZ-2,"Donald ye manje gomu dɔ di Leslie ma, a ka banabagatɔ laban, bawo _ ninakili kasa tun bɛ a la kaban.",Donald,Leslie,2
3ZZAYRN1I6PS0VSBJH17SJ60DNOTOA-2,"Samuel ye se sɔrɔ kɔfɛ seri jam ɲɛɲini na, Kyle tun b’a miiri hali bi k’u tun ka kan ka se sɔrɔ bawo _ tun bɛ dumuni duman kɛ ni dumuni duman ye min kalori ka dɔgɔn ani kiritigɛlaw y’a nɛnɛ dɔrɔn.",Samuel,Kyle,2
3ZZAYRN1I6PS0VSBJH17SJ60DNOTOA-1,"Samuel ye se sɔrɔ kɔfɛ seri jam ɲɛɲini na, Kyle tun b’a miiri hali bi k’u tun ka kan ka se sɔrɔ bawo _ tun bɛ dumuni duman kɛ ni dumuni duman ye min kalori ka ca ani kiritigɛlaw y’a nɛnɛ dɔrɔn.",Samuel,Kyle,1
3RKHNXPHGWUOAHMLLUZOQYBTHGGKUC-1,"Felicia ɲɛda tun bɛ i ko a dusu tiɲɛna ani a jigi tigɛlen don, a kɛlen kɔ k’a ɲini Christine fɛ a ka ban ka kɛ a terimuso ye bawo a diyara _ ye.",Felicia,Christine,1
3RKHNXPHGWUOAHMLLUZOQYBTHGGKUC-2,"Felicia ɲɛda tun bɛ i ko a dusu tiɲɛna ani a jigi tigɛlen don a kɛlen kɔ k’a ɲini Christine fɛ a ka ban ka kɛ a terimuso ye bawo _ , a tun tɛ musoɲɔgɔnɲinikɛla ye.",Felicia,Christine,2
30F94FBDNTYNBQ29ZA8LEXU9ZY4BTJ-1,Matthew b’a fɛ ka Kevin ka ntolatan biletiw feere bawo _ mago bɛ wari la.,Matthew,Kevin,1
30F94FBDNTYNBQ29ZA8LEXU9ZY4BTJ-2,Matthew b’a fɛ ka Kevin ka ntolatan biletiw feere nka wari tɛ _ bolo.,Matthew,Kevin,2
3TRB893CSLOW49DD2TXYACTOQQKG7W-2,Elena y’a fɔ Natalie ye ko a k’a ka jakite ka wuluwulu sama ka taa san fɛ bawo _ bɛ se ka nɛnɛ.,Elena,Natalie,2
3TRB893CSLOW49DD2TXYACTOQQKG7W-1,Elena y’a fɔ Natalie ye ko a k’a ka jakite ka wuluwulu sama ka taa san fɛ bawo _ tun t’a fɛ a ka nɛnɛ.,Elena,Natalie,1
30Y6N4AHYRA3A8N19HUW98HSF1TDRY-1,Lawrence ye daga dɔ dilan bɔgɔdaga feereyɔrɔ la ani Randy y’a kari bala la. _ y’a latigɛ ka dɔ wɛrɛ kɛ.,Lawrence,Randy,1
30Y6N4AHYRA3A8N19HUW98HSF1TDRY-2,Lawrence ye daga dɔ dilan bɔgɔdaga feereyɔrɔ la ani Randy y’a kari bala la. _ y’a jira ko a bɛna dɔ wɛrɛ kɛ.,Lawrence,Randy,2
35F6NGNVMAX09EZJMTW59V8EHIR7TU-1,Kungolo kuru tun mago tun bɛ fura la min tun bɛ kɛ o yɔrɔ la barisa _ tun fununen don.,kuru,fura,1
35F6NGNVMAX09EZJMTW59V8EHIR7TU-2,Kungolo kuru tun mago tun bɛ fura la min tun bɛ kɛ o yɔrɔ la bawo _ tun bɛna a minɛ.,kuru,fura,2
3Y3CZJSZ9KRTC691AD0DJY5RDO45RP-1,"Sue tun bɛ fini kɔrɔw di a ka dɛmɛjɛkulu ma min ka di a ye kosɛbɛ, nka nin san laban ninnu na, a ye sɛki sɛbɛn ci u ma dɔrɔn bawo _  sɔrɔli jara mɔgɔw ye.",sɛkiw,fini,1
3Y3CZJSZ9KRTC691AD0DJY5RDO45RP-2,"Sue tun bɛ fini kɔrɔw di a ka dɛmɛjɛkulu ma min ka di a ye kosɛbɛ, nka nin san laban ninnu na, a ye sɛki sɛbɛn ci u ma dɔrɔn bawo _  sɔrɔli ja mɔgɔw ye.",sɛkiw,fini,2
3KI0JD2ZU3WU7GO7QGOCYLG0X3C670-2,A bɛna dɛmɛ don ka Matthew farikoloɲɛnajɛ bolodalen dɔ sɛbɛn Christopher ye bawo _ tun tɛ a cogo la.,Matthew ,Christopher ,2
3KI0JD2ZU3WU7GO7QGOCYLG0X3C670-1,Matthew y’a fɔ ko a bɛna dɛmɛ don ka farikoloɲɛnajɛ bolodalen dɔ sɛbɛn Christopher ye bawo _ tun ye mɔgɔ yɛrɛ degebaga ye.,Matthew,Christopher,1
3QO7EE372Q1AJAAHI6EQ9SJMFJ1QB0-1,Jikuruw ye garazi tiɲɛ nka so in tora a cogo la bawo _ tun ka surun kɔgɔjida la kosɛbɛ.,garazi,So,1
3QO7EE372Q1AJAAHI6EQ9SJMFJ1QB0-2,Jikuruw ye garazi tiɲɛ nka so in tora a cogo la bawo _ tun yɔrɔ ka jan kosɛbɛ kɔgɔjida la.,garazi,so,2
3Z56AA6EK4YYYUWNAOE1P5PHYGD6ME-2,Katrina ye tapi feere Maria ma sigida sugu la bawo _ ye kiliyan ye.,Katrina,Maria,2
3Z56AA6EK4YYYUWNAOE1P5PHYGD6ME-1,Katrina ye tapi feere Maria ma sigida sugu la bawo _ ye feerekɛla ye.,Katrina,Maria,1
3UUSLRKAUL1EY04FG5KQCT2JPT87D0-2,"Asito ne Joantun b’a fɛ tuma bɛɛ ka ɲɔgɔn minɛ ani ka sumbuli kɛ, nka Joan tun ka fisa ni _ ye bawo a tun bɛ siran banakisɛw ɲɛ.", sumbuli, ɲɔgɔn minɛ ,2
3UUSLRKAUL1EY04FG5KQCT2JPT87D0-1,"Ken dego ne Joan b’a fɛ tuma bɛɛ ka ɲɔgɔn minɛ ani ka sumbuli kɛ, nka _ tun man di Joan ye bawo a tun bɛ siran banakisɛw ɲɛ.", ɲɔgɔn minɛ , ɲɔgɔn minɛ,1
35ZRNT9RUIWN1EUH42VGA622O6G3OD-2,Kitabumaraso tun bɛ gafew lajɛlenba dɔ mara nka tulon gafew tun tɛ yen bawo _ w tun bɛ sɛgɛn.,gafew,tulon gafew,2
35ZRNT9RUIWN1EUH42VGA622O6G3OD-1,Kitabumaraso tun bɛ lede bo dɔ mara nka komikɛw tun tɛ yen bawo _ tun ka di mɔgɔw ye.,komikɛw ,yen bawo,1
3DGDV62G7QNVVL96Z06Q8UQ9I1WP28-1,Carrie ka magan bɛ ni kiliyan kantigiw ye ka tɛmɛ Patricia ta kan bawo _ ka magan kɔrɔlen don.,Carrie,Patricia,1
3DGDV62G7QNVVL96Z06Q8UQ9I1WP28-2,Carrie ka magan bɛ ni kiliyan kantigiw ye ka tɛmɛ Patricia ta kan bawo _ ka magan ye kura ye.,Carrie,Patricia,2
3N2YPY1GI6WL1WJBUYYQOP07687EVK-1,Nia ka fo de Christine  dɔnni sɛgɛsɛgɛli la Jessica ye min kɛ bawo fɛn dɔ tun bɛ _ bolo ka dogo.,Christine , Jessica ,1
3N2YPY1GI6WL1WJBUYYQOP07687EVK-2,Christine ma se ka nkalon dɔnni sɛgɛsɛgɛli kɛ Jessica ye min kɛ bawo foyi tun tɛ _ bolo ka dogo.,Christine,Jessica,2
3DW3BNF1GJWJMK8R1TOQODSUPG9V83-1,Carrie tun ɲɛsinnen bɛ ventilateur ma ka yɔrɔ jan Angela la bawo _ tun bɛ ka funteni daminɛ kojugu dumunikɛyɔrɔ la.,Carrie,Angela,1
3DW3BNF1GJWJMK8R1TOQODSUPG9V83-2,Carrie ye ventilateur da Angela kan bawo _ tun ka suma kojugu dumunikɛyɔrɔ la.,Carrie,Angela,2
3OZ4VAIBEXDTCC538Z9HL5DZBHAJVJ-1,"Nɛnɛ ye Jason bolow ja, nka kabe ke Leslie ma ja, bawo _ tun bɛ ɲinɛ tuma bɛɛ ka ji kɛ su fɛ.",Jason ,Leslie,1
3OZ4VAIBEXDTCC538Z9HL5DZBHAJVJ-2,"Nɛnɛ ye Jason bolow ja, nka Leslie bolow ma ja, bawo _ ma ɲinɛ abada ka u ko su fɛ.",Jason,Leslie,2
3SU800BH86QALKKGYZJLMKN2B7IQUL-2,"Nande ki Carrie ye pari dɔ tiɲɛ Cynthia fɛ basikɛti tulon na, _ ye lɛrɛ caman kɛ ka saniya kɛ u ye.",Carrie,Cynthia,2
3SU800BH86QALKKGYZJLMKN2B7IQUL-1,"Ikomi Carrie ye pari dɔ tiɲɛ Cynthia fɛ basikɛti tulon na, _ ye lɛrɛ caman kɛ ka saniya kɛ.",Carrie,Cynthia,1
3S4TINXCC0LS49YUJVAMSP0ECY1BOK-2,Arajo lamɛn ka di n ye ka tɛmɛ telewisɔn filɛli kan wula fɛ bawo n b’a ye ko _ bɛ mɔgɔw tiɲɛ.,arajo,Telewisɔn,2
3S4TINXCC0LS49YUJVAMSP0ECY1BOK-1,Fenle kino de ka di n ye ka tɛmɛ telewisɔn filɛli kan wula fɛ bawo n b’a ye ko _ bɛ n hakili sigi.,fileni,telewison,1
3OLZC0DJ8LTCBQK4AF0H12M7R93VIR-1,"Randy y’a yɛrɛ ka jago daminɛ k’a sɔrɔ Ryan tun bɛ baara kɛ mɔgɔ wɛrɛ fɛ, o la sa, _ tun bɛ ni yɛrɛbaara taji ye.",Randy,Ryan,1
3OLZC0DJ8LTCBQK4AF0H12M7R93VIR-2,"Randy y’a yɛrɛ ka jago daminɛ k’a sɔrɔ Ryan tun bɛ baara kɛ mɔgɔ wɛrɛ fɛ, o de la _ tun bɛ ni W4 takasi ye.",Randy,Ryan,2
3NI0WFPPIBUGP5ON5H33J66DPUU60Y-2,"A cɛɲi nimisara ka jakite san a ye, ka fini kura san a ye bawo a tun b’a dɔn ko a hakili la ko _ bɛnnen don kosɛbɛ a ka finidoncogo ma.",wɛsiti,fúgula,2
3NI0WFPPIBUGP5ON5H33J66DPUU60Y-1,"A cɛɲi nimisara ka jakite san a ye, ka fini kura san a ye bawo a tun b’a dɔn ko a hakili la ko _ tɛ bɛn a ka finidoncogo ma.",wɛsiti,fúgula,1
3OID399FXG5RDTJLYOI20LF0NKKDF9-2,"Monica tun b’a fɛ ka baara kɛ ni aspirateur ye walasa ka duguma saniya, nka Victoria tun b’a fɛ ka baara kɛ ni bɔrɔ ye. _ ye duguma saniya dɔɔnin dɔɔnin kosɛbɛ.",Monica,Victoria,2
3OID399FXG5RDTJLYOI20LF0NKKDF9-1,"Monica tun b’a fɛ ka baara kɛ ni aspirateur ye walasa ka duguma saniya, nka Victoria tun b’a fɛ ka baara kɛ ni bɔrɔ ye. _ ye duguma saniya joona kosɛbɛ.",Monica,Victoria,1
31ANT7FQN80GNCVYE8OJ5U3LQG1H51-1,N ye furaji caman kɛ walasa ka wuluw bɔ nka u ma baara kɛ bawo fanga tun tɛ _ w la.,furaji,fɛnɲɛnamaw,1
31ANT7FQN80GNCVYE8OJ5U3LQG1H51-2,N ye furaji caman kɛ walasa ka wuluwuluw bɔ nka u ma baara kɛ bawo _ w barika tun ka bon.,furaji,fɛnɲɛnamaw,2
3O0M2G5VC8GK6C8MMPTHFJNRVLL49F-1,Tlebi nile de koni filimuw filɛli tun ka di Monica ye k’a sɔrɔ kanuya filimuw tun ka di Natalie ye kosɛbɛ bawo _ lamɔna foro dɔ la.,Monica,Natalie,1
3O0M2G5VC8GK6C8MMPTHFJNRVLL49F-2,Tlebi jamanaw ka filimuw filɛli tun ka di Monica ye k’a sɔrɔ kanuya filimuw tun ka di Natalie ye kosɛbɛ bawo _ lamɔna ka telewisɔn filɛ.,Monica,Natalie,2
3V8JSVE8Y04HZFDNJ7XANMS9HPVYEB-1,Anwa ledo ne ko ca gafemarayɔrɔ la ka tɛmɛ gafefeereso kan bawo _ tun ka bon.,gafemarayɔrɔ,gafefeereso,1
3V8JSVE8Y04HZFDNJ7XANMS9HPVYEB-2,Anwa ledo tun ka ca gafemarayɔrɔ lin me tɛmɛ gafefeereso kan bawo _ tun ka dɔgɔ.,gafemarayɔrɔ,gafefeereso,2
3WRBLBQ2GR63S9EMXW0P3ZVTPV4G0C-2,"Ja dilanni tun ye Sarah ka seko ye, nka Carrie ta tun tɛ, o de la _ tun b’a fɛ tuma bɛɛ k’a ka baara kɛlenw ye.",Sarah,Carrie,2
3WRBLBQ2GR63S9EMXW0P3ZVTPV4G0C-1,"Ja dilanni tun ye Sarah ka seko ye nka Carrie ta tun tɛ, o de la _ tun b’a fɛ tuma bɛɛ k’a ka baara kɛlenw jira a la.",Sarah,Carrie,1
3RZS0FBRWK8TZE21CVJWS9BMZ6JPC3-2,"Emily ye wari caman musaka a ka telefɔni seleke naani na, nka Rachel ye dɔ san min sɔngɔ man gɛlɛn bawo _ tun kɔrɔlen don kosɛbɛ.",Emily,Rachel,2
3RZS0FBRWK8TZE21CVJWS9BMZ6JPC3-1,"Emily ye wari caman musaka a ka telefɔni seleke naani na, nka Rachel ye dɔ san min sɔngɔ man gɛlɛn bawo _ tun cɛ ka ɲi kosɛbɛ.",Emily,Rachel,1
3ACRLU860PSLM7KC9FJQFBU9XUOBEF-2,"Te ni kafe ka kan ka min bɔli ani wɛrɛ minɛnw suguya wɛrɛw la. A ka c’a la, kafe bɛ min _ kɔnɔ, ni nɔnɔ ye ani tuma dɔw la sukaro.",bɔli,wɛrɛ,2
3ACRLU860PSLM7KC9FJQFBU9XUOBEF-1,"Te ni kafe ka kan ka min bɔli ani wɛrɛ minɛnw suguya wɛrɛw la. A ka c’a la, te bɛ min _ kɔnɔ, ni nɔnɔ ye ani tuma dɔw la sukaro.",bɔli,wɛrɛ,1
32PT7WK7DOTBR62ZYRT0RAEC9NDD3U-1,Neil ye Michael ɲininka a bɛ cogo di anbe kɛlɛ la bawo _ tun ye hɛrɛ ɲinibaga ye.,Neil,Michael,1
32PT7WK7DOTBR62ZYRT0RAEC9NDD3U-2,Neil ye Michael ɲininka a bɛ beko leni ka taa kɛlɛ la bawo _ tun ye sɔrɔdasi kɔrɔ ye.,Neil,Michael,2
3UEDKCTP9X416V9WSKID84LHXNJ7K4-2,N donna minɛn kɔnɔ ka diamant ɲini nka n ye quartz ni topazi dɔrɔn de sɔrɔ. N ye _ sugandi bawo a tun bɛ ɲini ka jɛya.,topazi,quartzi,2
3UEDKCTP9X416V9WSKID84LHXNJ7K4-1,N donna minɛn kɔnɔ ka diamant ɲini nka n ye quartz ni topazi dɔrɔn de sɔrɔ. N ye _ sugandi bawo a tun bɛ mɛnɛmɛnɛ i ko yeelen nɛrɛma.,topazi,quartzi,1
3D3B8GE892PR1GVY0B95QJAEY279P0-2,"Tobilikɛla hakili la, pɔmi dunni ka kɛnɛ ka tɛmɛ beteravu kan, o de y’a to a ka _ bilali kɔniya a ka buasɔn na.",pɔmiw,beteravuw,2
3D3B8GE892PR1GVY0B95QJAEY279P0-1,"Tobilikɛla hakili la, pɔmi dunni ka kɛnɛ ka tɛmɛ biyɛri kan, o de y’a to a ka di a ye ka _ don a ka buasɔn na.",pɔmiw,beteravuw,1
37VE3DA4YUFICSC7FIFW8G3DVYNHB5-1,"Jennifer tun bɛ farati la ka jɛgɛba dɔ sɔrɔ u ka jibɔ waati la, nka Emily tun tɛ o cogo la, bawo _ tun bɛ ka jɛgɛminɛ kɛ kɔgɔji kɔnɔ.",Jennifer,Emily,1
37VE3DA4YUFICSC7FIFW8G3DVYNHB5-2,"Jennifer tun bɛ farati la ka jɛgɛba dɔ sɔrɔ u ka jibɔ waati la, nka Emily tun tɛ o cogo la, bawo _ tun bɛ ka jɛgɛminɛ kɛ baji kɔnɔ.",Jennifer,Emily,2
3EQVJH0T40JI8E6OF46H8A9Z6IJHTM-1,"Sɛbɛn minnu tun bɛ dosiew kɔnɔ, olu tun tɛ se ka don ka ɲɛ. _ tun ka dɔgɔ kojugu.",dosiew,sɛbɛn,1
3EQVJH0T40JI8E6OF46H8A9Z6IJHTM-2,"Sɛbɛn minnu tun bɛ foli kɔnɔ, olu tun tɛ se ka don ka ɲɛ. _ tun ka bon kojugu.",dosiew,sɛbɛn,2
35ZRNT9RUIWN1EUH42VGA622JTGO33-1,"Lawrence tun ye kalanbaga ŋana ye, a tun bɛ nsiirinw kalan k’a sɔrɔ Jason tun bɛ nsiirinw kalan minnu tɛ nsiirinw ye. A tun ka di _ ye ka boli ka don diɲɛ kɔnɔ min bɛ mɔgɔ bila ka miiri.",Lawrence,Jason,1
